id,name,popularity,overview,first_air_date,poster_path
62110,Assassination Classroom,380.435,"The students of Class 3-E have a mission: kill their teacher before graduation. He has already destroyed the moon, and has promised to destroy the Earth if he can not be killed within a year. But how can this class of misfits kill a tentacled monster, capable of reaching Mach 20 speed, who may be the best teacher any of them have ever had?",2013-01-10,https://image.tmdb.org/t/p/w500/wOd98jDHkoWy2LZ4gSy67X1ihv1.jpg
6357,The Twilight Zone,288.965,"A series of unrelated stories containing drama, psychological thriller, fantasy, science fiction, suspense, and/or horror, often concluding with a macabre or unexpected twist.",1959-10-02,https://image.tmdb.org/t/p/w500/7uY4pCOxbEdv4M8jTE4uMPVoSIW.jpg
40696,Wolffs Revier,259.818,Wolffs Revier is a German television series.,1992-09-17,https://image.tmdb.org/t/p/w500/3kaRO640QdIN9zZLeLyfz0Bsydi.jpg
36062,Best Friends,377.997,"Best Friends follows the life of a group of friends at their high school ‘Spangalis College’. Inside and outside of school exciting and challenging experiences take place. Growing up is never easy; every character has its own, unique story of love, friendship, loneliness, sorrow, discovery. There is drama and joy in school, family, teachers, parents, divorce, bullying, and always dreams for the future.",2007-09-03,https://image.tmdb.org/t/p/w500/2bH7QQ7WQfnbt1CWiX8BE5E2V4t.jpg
212907,La promesa,268.692,"In 1913 Spain, a woman gets a job at the palace of La Promesa as a reward for saving the marquesses' son - but nobody knows that she has her own plans, which involve avenging her mother's death and finding her missing brother.",2023-01-12,https://image.tmdb.org/t/p/w500/y656ZhHU2Hh3bmC5vBtMa2vKpUM.jpg
31497,The League,287.903,The League is an American sitcom and semi-improvised comedy about a about a fantasy football league and its members and their everyday lives.,2009-10-29,https://image.tmdb.org/t/p/w500/2l9lrTVG0BxU7zqsf5UQ1g4AbBH.jpg
29452,"Heidi, Girl of the Alps",287.588,"After becoming an orphan, Heidi is forced to live with her grandfather Öhi who lives in the mountain Alps. However he is a very bitter man who only accepts to take her in by force. Heidi's kindness may be able to open Öhi's heart. Along with Peter the goat carer and the crippled Klara, Heidi has a lot of adventures.",1974-01-06,https://image.tmdb.org/t/p/w500/nAKSRtyLnjV3bcpyaxlhyFtMVQJ.jpg
2190,South Park,287.016,"Follows the misadventures of four irreverent grade-schoolers in the quiet, dysfunctional town of South Park, Colorado.",1997-08-13,https://image.tmdb.org/t/p/w500/xJnbMTrJ2fl1AXAKx34U4BPvOhs.jpg
69500,Natsume's Book of Friends,286.489,"Natsume Takashi has the ability to see spirits, which he has long kept secret. However, once he inherits a strange book that belonged to his deceased grandmother, Reiko, he discovers the reason why spirits surround him.",2008-07-08,https://image.tmdb.org/t/p/w500/c4B2NFHFH0N8W7ovMsxiGIj7Fgp.jpg
61923,Star vs. the Forces of Evil,285.964,"Intergalactic warrior Star Butterfly arrives on Earth to live with the Diaz family. She continues to battle villains throughout the universe and high school, mainly to protect her extremely powerful wand, an object that still confuses her.",2015-01-18,https://image.tmdb.org/t/p/w500/dKFL1AOdKNoazqZDg1zq2z69Lx1.jpg
40290,MasterChef,285.768,"This hit cooking competition series sees award-winning chef Gordon Ramsay and other celebrity chefs put a group of contestants through a series of challenges and elimination rounds, in order to turn one home cook into a culinary master.",2010-07-27,https://image.tmdb.org/t/p/w500/42gO1qCC6GPtHKNXvOdhunhzyS3.jpg
17887,7de Laan,285.709,"7de Laan is an extraordinary microcosm where good and bad, evil and wholesome characters find themselves forming part of a wholesome community where no matter what – everyone counts and everyone cares…",2000-04-04,https://image.tmdb.org/t/p/w500/vQcC4Kcx0ZEXxmj0gUrfkFR14LU.jpg
99530,Transplant,285.68,"Dr. Bashir Hamed, a Syrian doctor with battle-tested skills in emergency medicine, makes the difficult decision to flee his country and build a new life in Canada with his younger sister Amira. Bash works to navigate a new environment after earning a coveted residency in the Emergency Department of one of the best hospitals in Toronto, York Memorial.",2020-02-26,https://image.tmdb.org/t/p/w500/ukvqJZI0XctnLst0CTE2r0AC2eu.jpg
61709,Dragon Ball Z Kai,285.067,"Rejoin Goku and his friends in a series of cosmic battles! Toei has redubbed, recut, and cleaned up the animation of the original 1989 animated series. The show's story arc has been refined to better follow the comic book series on which it is based. The show also features a new opening and ending. In the series, martial artist Goku, and his various friends, battle increasingly powerful enemies to defend the world against evil. Can Earth's defender defeat demons, aliens, and other villains?",2009-04-05,https://image.tmdb.org/t/p/w500/ykl67ghR2ug6KGFH3CQcI01pzQJ.jpg
46004,Date a Live,285.041,"Thirty years ago a strange phenomenon called a ""spacequake"" devastated the center of Eurasia, claiming the lives of at least 150 million people. Since then, smaller spacequakes plague the world on an irregular basis. Shido Itsuka, a seemingly ordinary high schooler comes across a mysterious girl at the ground zero of a spacequake and learns she is one of the ""Spirits"" who are the real cause of the spacequakes that occur when they manifest themselves in the world. He is recruited to make use of his mysterious ability to seal the Spirits' powers thus stopping them from being a threat to mankind. However, there is a catch: to seal a Spirit's power, he must make her fall in love with him and kiss him.",2013-04-06,https://image.tmdb.org/t/p/w500/vzaf5B2S00Ww3CwUck9IryUuFqP.jpg
67116,Lethal Weapon,284.882,A slightly unhinged former Navy SEAL lands a job as a police officer in Los Angeles where he's partnered with a veteran detective trying to keep maintain a low stress level in his life.,2016-09-21,https://image.tmdb.org/t/p/w500/jbMZkxLHVDSKiZh0HppCthRW96k.jpg
947,Cheyenne,284.544,"Cheyenne is an American western television series of 108 black-and-white episodes broadcast on ABC from 1955 to 1963. The show was the first hour-long western, and in fact the first hour-long dramatic series of any kind, with continuing characters, to last more than one season. It was also the first series to be made by a major Hollywood film studio which did not derive from its established film properties, and the first of a long chain of Warner Brothers original series produced by William T. Orr.",1955-09-20,https://image.tmdb.org/t/p/w500/osdglTGStAMbThkUsVJ0DRzvwrq.jpg
67335,Sin senos sí hay paraíso,284.318,A young woman born in a mafia-controlled town seeks revenge on those who wrongfully harmed and imprisoned her family.,2016-07-19,https://image.tmdb.org/t/p/w500/7lBJ6lOS0uQqsH13U9iMTikawQS.jpg
3673,Crown Court,284.293,"Crown Court is an afternoon television courtroom drama produced by Granada Television for the ITV network that ran from 1972, when the Crown Court system replaced Assize courts and Quarter sessions in the legal system of England and Wales, to 1984.",1972-10-11,https://image.tmdb.org/t/p/w500/8nT9SyvLcIkXeYRT6me3Tb8YHGV.jpg
44371,Spaceship Sagittarius,283.7,"Uchūsen Sagittarius is a 77-episode Japanese science fiction anime series directed by Kazuyoshi Yokota and created by Nippon Animation and TV Asahi. It aired from January 10, 1986 to October 3, 1987.

The series is based on Altri Mondi, an Italian comic book drawn by physicist Andrea Romol.",1986-01-10,https://image.tmdb.org/t/p/w500/qNOWfrdytHnbO2PQadVAJG4Pq71.jpg
94523,Magia Record: Puella Magi Madoka Magica Side Story,283.45,"Few people know the truth: the world is safe thanks to the Magical Girls who are forced to slay Witches. Even though these girls are putting their lives on the line for a wish, rumors say they can be saved in Kamihama City. That’s where Iroha Tamaki is headed in search of answers; she can’t remember the wish she made to Kyubey.",2020-01-05,https://image.tmdb.org/t/p/w500/ySz7DoQvwaZLvQ3b5DbUOteATE.jpg
14781,The Detectives,282.093,"The Detectives is an American crime drama series which ran on ABC during its first two seasons, and on NBC during its third and final season. The series, starring motion picture star Robert Taylor, was produced by Four Star Television.",1959-10-16,https://image.tmdb.org/t/p/w500/AfTnudiCwpKitJ6XZcCj16FeIup.jpg
72649,Hot Ones,281.606,The show with hot questions and even hotter wings invites a famous guest over to eat and then interviews them while they're struggling through the heat.,2015-03-12,https://image.tmdb.org/t/p/w500/4uudasFgKCVQFNGqfanD6wEGVS1.jpg
28032,Eurovision Song Contest,281.448,"The Eurovision Song Contest is an international song competition, organised annually by the European Broadcasting Union (EBU) and featuring participants representing primarily European countries. Each participating country submits an original song to be performed on live television and radio, transmitted to national broadcasters via the EBU's Eurovision and Euroradio networks, with competing countries then casting votes for the other countries' songs to determine the winner.",1956-05-24,https://image.tmdb.org/t/p/w500/kG2UO5pT91NckAe3tS6WrgxOB3P.jpg
2222,The Division,281.106,"The Division is an American crime drama television series created by Deborah Joy LeVine and starring Bonnie Bedelia. The series focused on a team of women police officers in the San Francisco Police Department. The series premiered on Lifetime on January 7, 2001 and ended on June 28, 2004 after 88 episodes.",2001-01-07,https://image.tmdb.org/t/p/w500/5FE02HHz3Uv9T0yThBq1SahJ4yV.jpg
34839,Queen Millennia,281.061,"Queen Millennia is a manga series by Leiji Matsumoto which was serialized from 28 January 1980 through 11 May 1983 in both the Sankei Shimbun and Nishinippon Sports newspapers. The manga series was adapted into a 42-episode anime TV series by Toei Dōga and broadcast on the Fuji TV network from 16 April 1981 through 25 March 1982. An anime film was released on 13 March 1982 shortly before the TV series ended.

The anime series was combined by Harmony Gold and Carl Macek with episodes from the 1978 Matsumoto series, Space Pirate Captain Harlock, and shown from 1985 to 1986 in the United States as the 65-episode Captain Harlock and the Queen of a Thousand Years. The series was broadcast in Germany on Tele 5 during 1992 and on Mangas in France in 2004.",1981-04-16,https://image.tmdb.org/t/p/w500/tf2Je0XAPs9Q7GRVqDjpjj0Ln5b.jpg
4660,Adam-12,280.391,"Adam-12 is a television police drama that followed two police officers of the Los Angeles Police Department, Pete Malloy and Jim Reed, as they patrolled the streets of Los Angeles in their patrol unit, 1-Adam-12.",1968-09-21,https://image.tmdb.org/t/p/w500/9hY1H8A6sPghNNHPQJYMgJYpemZ.jpg
46018,Tieta,279.829,"Inspired on Jorge Amado's romance ""Tieta do Agreste"", the plot is set on the fictional city of Santana do Agreste, at Brazil's northwest, and has as main theme Tieta's life turnarounds. Twenty-five years after being chased out of town by her father Zé Esteves, she returns to her home town seeking revenge against everyone who mistreated her and laugh at her face in the past.",1989-08-14,https://image.tmdb.org/t/p/w500/3YNb7mSpuaP18W4yAXjtaV5W2lI.jpg
40,Dallas,279.658,"The world's first mega-soap, and one of the most popular ever produced, Dallas had it all. Beautiful women, expensive cars, and men playing Monopoly with real buildings. Famous for one of the best cliffhangers in TV history, as the world asked ""Who shot J.R.?"" A slow-burner to begin with, Dallas hit its stride in the 2nd season, with long storylines and expert character development. Dallas ruled the airwaves in the 1980's.",1978-04-02,https://image.tmdb.org/t/p/w500/w8Frf2mO0DUVHmSRJWJWldntKCt.jpg
73048,SNL Korea,279.579,"Korea's version of the late-night live television sketch comedy and variety show. The show's comedy sketches, which parody contemporary culture and politics, are performed by a large and varying cast of repertory cast members.",2011-12-03,https://image.tmdb.org/t/p/w500/1feD9WnGOU19juCw79fACNmG7n4.jpg
34522,Adaalat,279.397,"K.D Pathak is a suave, sophisticated, witty and yet unconventional defence lawyer with an impeccable track record. He stands not for his client, but for Justice.",2010-11-20,https://image.tmdb.org/t/p/w500/m2G5WVHX4n2ETdBpAUHGK71C0J7.jpg
62649,Superstore,279.182,"A hilarious workplace comedy about a unique family of employees at a super-sized mega store. From the bright-eyed newbies and the seen-it-all veterans to the clueless summer hires and the in-it-for-life managers, together they hilariously tackle the day-to-day grind of rabid bargain hunters, riot-causing sales and nap-worthy training sessions.",2015-11-30,https://image.tmdb.org/t/p/w500/maBJkaBM4UqAttn9UkLCfZEVEfk.jpg
37863,Fullmetal Alchemist,278.153,"Two young brothers are raised as alchemists, but when they are severely injured trying to perform a forbidden act, they begin searching for the one thing that can save them; the fabled philosopher's stone.",2003-10-04,https://image.tmdb.org/t/p/w500/7qVSNBKsrER8P77DfsSQfrPK04L.jpg
40605,Die Harald Schmidt Show,277.163,"The Harald Schmidt Show is a German late night talk show hosted on Sky Deutschland by comedian Harald Schmidt. The show first aired from 5 December 1995 to 23 December 2003 on Sat.1. Schmidt then moved his show to Das Erste as Harald Schmidt and Schmidt & Pocher, but he returned to Sat.1 on 13 September 2011. After cancellation on Sat.1, the show continued on Sky Deutschland in September 2012.",1995-12-05,https://image.tmdb.org/t/p/w500/lQcE1AzjDP5zJRUW76PMRn7ai9W.jpg
46533,The Americans,276.947,"Set during the Cold War period in the 1980s, The Americans is the story of Elizabeth and Philip Jennings, two Soviet KGB officers posing as an American married couple in the suburbs of Washington D.C. and their neighbor, Stan Beeman, an FBI Counterintelligence agent.",2013-01-30,https://image.tmdb.org/t/p/w500/w1UBlxEXhbKe8sp0fxFZh7MqTce.jpg
14981,The Late Late Show with Craig Ferguson,276.904,"The Late Late Show with Craig Ferguson is an American late-night talk show hosted by Scottish American comedian Craig Ferguson, who is the third regular host of the Late Late Show franchise. It follows Late Show with David Letterman in the CBS late-night lineup, airing weekdays in the US at 12:37 a.m. It is taped in front of a live studio audience from Monday to Friday at CBS Television City in Los Angeles, California, directly above the Bob Barker Studio. It is produced by David Letterman's production company Worldwide Pants Incorporated and CBS Television Studios.

Since becoming host on January 3, 2005, after Craig Kilborn and Tom Snyder, Ferguson has achieved the highest ratings since the show's inception in 1995. While the majority of the episodes focus on comedy, Ferguson has also addressed difficult subject matter, such as the deaths of his parents, and undertaken serious interviews, such as one with Desmond Tutu, which earned the show a 2009 Peabody Award.",2005-01-03,https://image.tmdb.org/t/p/w500/gGC7zSDgG0FY0MbM1pjfhTCWQBI.jpg
35894,Zatch Bell!,276.182,"Takamine Kiyomaro, a depressed don't-care-about-the-world guy, was suddenly given a little demon named Zatch Bell to take care of. Little does he know that Zatch is embroiled in an intense fight to see who is the ruler of the demon world.",2003-04-06,https://image.tmdb.org/t/p/w500/cBcHLTG8UgtKi1i1iN0XVcRAB78.jpg
197150,Welcome to the Mushroom House,275.831,,2022-04-08,https://image.tmdb.org/t/p/w500/wPabr9Xo2DjQziZzCzxY07GNGN9.jpg
4586,Gilmore Girls,275.56,"Set in the charming town of Stars Hollow, Connecticut, the series follows the captivating lives of Lorelai and Rory Gilmore, a mother/daughter pair who have a relationship most people only dream of.",2000-10-05,https://image.tmdb.org/t/p/w500/8hWwBpB1mLUKqzjdGrcvJcIklp4.jpg
32415,Conan,275.511,A late night television talk show hosted by  Conan O'Brien.,2010-11-08,https://image.tmdb.org/t/p/w500/oQxrvUhP3ycwnlxIrIMQ9Z3kleq.jpg
4278,Friday Night Lights,275.475,"The trials and triumphs of life in the small town of Dillon, Texas, where high school football is everything.",2006-10-03,https://image.tmdb.org/t/p/w500/Eu7MzZY1DldJ683z7vLkILHNRD.jpg
71026,Super Wings,275.366,"An action-packed preschool series about an adorable jet plane named Jett who travels the world delivering packages to children. On every delivery, Jett encounters a new problem that the he and his friends the Super Wings must work together to solve!",2014-09-01,https://image.tmdb.org/t/p/w500/lu2DNsIQgn1Jb6djHvrqJSUQXXl.jpg
62704,Ballers,275.292,"Looking at the lives of former and current football players, the show follows former superstar Spencer Strasmore as he gets his life on track in retirement while mentoring other current and former players through the daily grind of the business of football.",2015-06-21,https://image.tmdb.org/t/p/w500/WyIazPyjmcFMC42nWEpI0jr56x.jpg
34921,The Wiggles,275.169,"A show geared for babies up to older toddlers. This show is full of music, teaching kids songs and easy dances.",1998-07-31,https://image.tmdb.org/t/p/w500/e4O9IXM3ZmuDsrEICslrwqCl7MT.jpg
37971,Der Alte,274.854,"A police department, lead by an older, experienced detective solve crimes together.",1977-04-11,https://image.tmdb.org/t/p/w500/cHkQqbrVzcwuvLwStBpERJnxx4g.jpg
4274,Tom & Jerry Kids Show,274.205,"Tom and Jerry in their childhood days, playing cat-and-mouse games even then.",1990-09-08,https://image.tmdb.org/t/p/w500/pApniCXhegDnhxQda7RcpG8gFP0.jpg
1100,How I Met Your Mother,273.899,A father recounts to his children - through a series of flashbacks - the journey he and his four best friends took leading up to him meeting their mother.,2005-09-19,https://image.tmdb.org/t/p/w500/b34jPzmB0wZy7EjUZoleXOl2RRI.jpg
91755,Super Trio Series,273.273,"The Super Trio Series is a Hong Kong variety show produced by TVB. The series debuted in 1995, and remained in production for eighteen years due to its popularity. The show was hosted by Eric Tsang and his two assistants - Jerry Lamb and Chin Kar-lok. The show initially ended its run with the airing of the final episode on July 16, 2005. However, on March 9, 2008, the first episode of the show's spin-off series Super Trio Wonder Trip was aired; its main purpose was to introduce a series of new games that are to be imported from various game shows all over the world and would appear in series 8, Super Trio Supreme.",1995-12-20,https://image.tmdb.org/t/p/w500/Sw4nK25cYJs6DQYPKqC54FWTik.jpg
66584,99.9 Criminal Lawyer,273.014,"Hiroto Miyama is an unconventional young lawyer who dances to his own tune and gets a little obsessive. For one thing, he’s only interested in criminal cases, and he will never give up in his pursuit of the truth even if offers only a 0.1% chance of being discovered. Japan’s 99.9% criminal case conviction rate leads the world, attesting to a “highly reliable” judicial system. In other words, once a crime suspect is indicted, prosecutor arguments tend to be accepted hook, line and sinker. In the face of those 99.9% odds, there’s no money in being a defense lawyer specializing in criminal cases, but for Miyama, that’s where the interest and kernels of truth lie. From unexpected places, the mold-breaking Miyama stakes his reputation on a prayer of a chance as he clashes with hotshot lawyers who’ll go to any lengths to win in this gloriously fun, legal mystery.",2016-04-17,https://image.tmdb.org/t/p/w500/ex8Rr04vsjp6EB55t7eCAE0tCNt.jpg
71932,AVN Awards,272.889,"The AVN Awards are movie awards sponsored and presented by the American adult video industry trade magazine AVN (Adult Video News) to honor exceptional performance in various aspects of the creation and marketing of American pornographic movies. The ""Oscars of porn"".",1984-01-01,https://image.tmdb.org/t/p/w500/meAZQwFtgnlFHEsPuZYDoV7mdkU.jpg
31679,Last Exile,271.869,"A richly romantic action-adventure fantasy, set in a world where retro-futuristic vehicles permeate the skies. Against this lavish background are the lives of young and heroic van ship sky porters - Claus and Lavie - who are forced to take on the mission to deliver a mysterious girl, Alvis, to the battle ship Silvana. Before they know it, they become entangled in an aerial adventure between two countries gripped in an eternal war of magnificent air battleships.",2003-04-07,https://image.tmdb.org/t/p/w500/yHA9G9NCk5HHmQhgzy2EEbRaXvQ.jpg
502,Sesame Street,271.618,"On a special inner city street, the inhabitants—human and muppet—teach preschoolers basic educational and social concepts using comedy, cartoons, games, and songs.",1969-11-10,https://image.tmdb.org/t/p/w500/14k9BfZ2p4rQBMeJ5crKTfUZVwD.jpg
4026,CBS News Sunday Morning,271.403,"The sparkling notes of a trumpet fanfare and the familiar logo of the sun alert viewers that it's time for CBS's Sunday morning staple. Journalist Jane Pauley helms the show, taking over hosting duties from Charles Osgood, who spent 22 years on the job. A morning talk show, this program airs at a different pace and focuses much of its attention on the performing arts. After a quick update of the day's news and national weather, correspondents offer longer-length segments on a variety of topics, from architecture to ballet to music to pop culture to politics.",1979-01-28,https://image.tmdb.org/t/p/w500/4AL2bjz8IROQi05frEaPHr9A7pr.jpg
3840,The Commish,270.984,"Tony Scali is a former Brooklyn cop now the Police Commissioner of a small upstate city. But for Scali, this is no desk job. He's a tough yet compassionate boss, a loving husband and father, and a hands-on law enforcer with an unorthodox style of bending the rules. From parenthood to politics, from sex crimes to murder cases, one man takes it day-to-day with offbeat humor and street- smart skill.",1991-09-28,https://image.tmdb.org/t/p/w500/osvVYFdCtz223oOQmMcoM1N4JGP.jpg
60863,Haikyu!!,270.329,"Inspired by a small-statured pro volleyball player, Shouyou Hinata creates a volleyball team in his last year of middle school. Unfortunately the team is matched up against the ""King of the Court"" Tobio Kageyama's team in their first tournament and inevitably lose. After the crushing defeat, Hinata vows to surpass Kageyama. After entering high school, Hinata joins the volleyball team only to find that Tobio has also joined.",2014-04-06,https://image.tmdb.org/t/p/w500/h0bVEP8doITKTfrkEhzgGesYuQz.jpg
2179,"Quincy, M.E.",270.14,Los Angeles County medical examiner Quincy routinely engages in police investigations.,1976-10-03,https://image.tmdb.org/t/p/w500/e0bsxZqhE5fhRjaX2LKu8GuKccE.jpg
61324,"Su Baek-hyang, the King's Daughter",269.587,"This is the story of Su Baek-hyang, born as the elder daughter of King Mu-ryeong but unable to retain her title of princess due to her ambitious younger sister, Sol-hui. Humble and hard-working, she was taught never to want or to desire beyond what she has, but the fate given to her is one that will affect not only her life and her family's lives, but the entire nation as she struggles to find her place in life and fight for love.",2013-09-30,https://image.tmdb.org/t/p/w500/6jrDwaMik2DlI1dFkC6ejJLjGPJ.jpg
71738,The Orville,269.398,"Follow the crew of the not-so-functional exploratory ship in the Earth's interstellar fleet, 400 years in the future.",2017-09-10,https://image.tmdb.org/t/p/w500/78xnHh9H5wYcUeZoB0bt1UgInAW.jpg
217772,GG Bond,269.064,,2006-07-01,https://image.tmdb.org/t/p/w500/9XC8xxZU01ZMtilejudKuJtPHbV.jpg
69740,Ozark,268.985,"A financial adviser drags his family from Chicago to the Missouri Ozarks, where he must launder $500 million in five years to appease a drug boss.",2017-07-21,https://image.tmdb.org/t/p/w500/m73bD8VjibSKuTWg597GQVyVhSb.jpg
41727,Banshee,266.206,Banshee is an American drama television series set in a small town in Pennsylvania Amish country and features an enigmatic ex-con posing as a murdered sheriff who imposes his own brand of justice while also cooking up plans that serve his own interests.,2013-01-11,https://image.tmdb.org/t/p/w500/5nXFiz8Rn8eezVjSTZBd7HmnF1G.jpg
1417,Glee,265.562,"In this musical comedy, optimistic high school teacher Will Schuester tries to refuel his own passion while reinventing the high school's glee club and challenging a group of outcasts to realize their star potential as they strive to outshine their singing competition while navigating the cruel halls of McKinley High.",2009-05-19,https://image.tmdb.org/t/p/w500/62T2vsZYTje3KhdCsiLR1K1RFJW.jpg
42569,Animal Detectives Kiruminzoo,265.29,"While searching for a run-away cat the twins Riko and Rimu Mikogami find a strange device that transforms them into ""Kirumin."" It also enables them to turn into real animals. Their older sister Nagisa soon joins them. Now the three have cute, funny and sometimes dangerous adventures.",2009-10-05,https://image.tmdb.org/t/p/w500/usM66LNNkQzCIxXsTtCbUvgSDJo.jpg
