id,name,popularity,overview,first_air_date,poster_path
206559,Binnelanders,3736.719,"A South African Afrikaans soap opera. It is set in and around the fictional private hospital, Binneland Kliniek, in Pretoria, and the storyline follows the trials, trauma and tribulations of the staff and patients of the hospital.",2005-10-13,https://image.tmdb.org/t/p/w500/3bzECfllho8PphdYujLUIuhncJD.jpg
93405,Squid Game,3138.471,"Hundreds of cash-strapped players accept a strange invitation to compete in children's games. Inside, a tempting prize awaits — with deadly high stakes.",2021-09-17,https://image.tmdb.org/t/p/w500/dDlEmu3EZ0Pgg93K2SVNLCjCSvE.jpg
94722,Tagesschau,2713.543,"German daily news program, the oldest still existing program on German television.",1952-12-26,https://image.tmdb.org/t/p/w500/7dFZJ2ZJJdcmkp05B9NWlqTJ5tq.jpg
2734,Law & Order: Special Victims Unit,2186.013,"In the criminal justice system, sexually-based offenses are considered especially heinous. In New York City, the dedicated detectives who investigate these vicious felonies are members of an elite squad known as the Special Victims Unit. These are their stories.",1999-09-20,https://image.tmdb.org/t/p/w500/abWOCrIo7bbAORxcQyOFNJdnnmR.jpg
257048,Garota do Momento,2110.602,,2024-11-04,https://image.tmdb.org/t/p/w500/jFSkjQSZ5Td52igalpoTQRuHtk.jpg
251691,Autumn of the Heart,2103.202,"A devastating car accident unearths a long-buried secret that turns wealthy businessman Rashid and hardworking Nahla's life around; fifteen years ago, their daughters were switched at birth.",2024-10-27,https://image.tmdb.org/t/p/w500/8uDmIxjBx90y5OCwJDBADtQzxb7.jpg
257064,Volta por Cima,2100.476,,2024-09-30,https://image.tmdb.org/t/p/w500/nyN8R0P1Hqwq7ksJz4O2BIAUd4W.jpg
205582,Brisant,1893.032,,1994-01-03,https://image.tmdb.org/t/p/w500/mzxp9rTCepnSe8wl0GzZLave9bd.jpg
274717,MDR aktuell,1886.759,,2021-02-04,https://image.tmdb.org/t/p/w500/u2on02K66lrXULRlJryBwm3BX1c.jpg
13008,TMZ,1868.98,"Based on the popular gossip website, this entertainment newsmagazine delivers daily updates on Hollywood's rich, beautiful and screwed-up. The program often shows highlights of the day's staff meeting during which reporters pitch ideas for stories to air that day.",2007-09-10,https://image.tmdb.org/t/p/w500/ifFpUG51DJaQxwnZ35VwoGRFGGv.jpg
112470,Ici tout commence,1842.068,"This television drama series is centered around the prestigious culinary school of renowned chef Auguste Armand. The show follows the lives of students and staff as they navigate the challenges and pressures of the culinary world—delving into their personal and professional lives, revealing secrets, rivalries, and complex relationships.",2020-11-02,https://image.tmdb.org/t/p/w500/v7nXPo2zdaIOfeIaERiOuTEt89N.jpg
237478,Crazy About You,1816.097,"The story begins with the ambiguous relationship between friends Viola and Luma, who seem predestined to literally enter each other's lives. Born on the same day, in very different situations, they meet years later, united by coincidences that go beyond their birthday. From humble origins, Viola moves with her boyfriend Mavi to Angra dos Reis, where Luma lives a luxurious life and dates Rudá, who ends up meeting Viola by chance. Thus begins the duo's journey, which goes from a passion for recipes to an obsession with the same man, from the immediate connection to the point of starting to live their friend’s reality, 10 years later. A journey divided between complicity and rivalry, which includes them in a love quadrangle and is impacted by a series of circumstances, twists and surprises, such as the secret surrounding a murder.",2024-09-09,https://image.tmdb.org/t/p/w500/cRMofv8YC4F1WnpF7cIqMpwSnwh.jpg
242722,Shrimad Ramayan,1773.407,"Shrimad Ramayan is an ambitious television series that brings to life the timeless epic, the Ramayan, with a deep commitment to authenticity, cultural reverence and a contemporary sensibility.",2024-01-22,https://image.tmdb.org/t/p/w500/aCDK83ykQYnQGFOTfiLjnoqXv1b.jpg
278181,Hessenschau,1754.196,,1961-07-30,https://image.tmdb.org/t/p/w500/7UZNF63NrEk8k6warEWgg3OLwGW.jpg
249010,Kelders van Geheime,1682.589,"Kelders van Geheime (Cellars of Secrets) is a South African, Afrikaans-language telenovela based on the wheeling's and dealings of the community that lives on Soebatskloof (a wine farm in the Cape). The series focuses on three families: the Abrahams, Syster and Marais households. These families will have to stand together, agree (or agree to disagree), and work together to earn their bread and butter – and a glass of wine.",2024-05-06,https://image.tmdb.org/t/p/w500/vf1I0G5jICTstI1EXxb9Oqq80TU.jpg
91363,What If...?,1670.462,"Taking inspiration from the comic books of the same name, each episode of this animated anthology series questions, revisits and twists classic Marvel Cinematic moments.",2021-08-11,https://image.tmdb.org/t/p/w500/lztz5XBMG1x6Y5ubz7CxfPFsAcW.jpg
248890,Ready Steady Cook South Africa,1661.821,"In Ready Steady Cook, two teams - a Red Tomato and a Green Pepper - compete in a Red Kitchen and a Green Kitchen, together with a South African chef on each side and paired with enthusiastic home cooks, as they are challenged creatively with a mystery bag of ingredients in a 20-minute cook-off.",2024-03-18,https://image.tmdb.org/t/p/w500/30xX4IMbgnMbQwo76xM4BOSokZO.jpg
456,The Simpsons,1583.393,"Set in Springfield, the average American town, the show focuses on the antics and everyday adventures of the Simpson family; Homer, Marge, Bart, Lisa and Maggie, as well as a virtual cast of thousands. Since the beginning, the series has been a pop culture icon, attracting hundreds of celebrities to guest star. The show has also made name for itself in its fearless satirical take on politics, media and American life in general.",1989-12-17,https://image.tmdb.org/t/p/w500/vHqeLzYl3dEAutojCO26g0LIkom.jpg
260695,sensitive chord,1552.639,"In a social dramatic context, the events of the series revolve around the issue of marital infidelity and the secrets of the human soul through three women (a doctor, a lawyer, and an employee in one of the departments), where the pace of events escalates due to the disputes between the lawyer and her husband, an interior designer, especially after she accused him of betrayal, with the intertwined relationships between all parties.",2024-10-27,https://image.tmdb.org/t/p/w500/hHoBvznjHhGqPKNkRnqb9zUq8s6.jpg
4614,NCIS,1359.673,"From murder and espionage to terrorism and stolen submarines, a team of special agents investigates any crime that has a shred of evidence connected to Navy and Marine Corps personnel, regardless of rank or position.",2003-09-23,https://image.tmdb.org/t/p/w500/mBcu8d6x6zB1el3MPNl7cZQEQ31.jpg
6883,BBC World News America,1322.598,BBC World News America is a current affairs news programme produced by BBC News especially targeted towards American audiences. It is presented by rotating presenters Caitríona Perry and Sumi Somaskanda.,2007-04-16,https://image.tmdb.org/t/p/w500/ahbTgC581tpCGg5M9LMXPcl6nq5.jpg
1416,Grey's Anatomy,1305.072,Follows the personal and professional lives of a group of doctors at Seattle’s Grey Sloan Memorial Hospital.,2005-03-27,https://image.tmdb.org/t/p/w500/7jEVqXC14bhfAzSPgr896dMdDv6.jpg
36361,Ulice,1294.941,"Ulice is a Czech soap opera produced and broadcast by Nova. In the Czech language Ulice means street.

The show describes the lives of the Farský, Jordán, Boháč, Nikl, and Liška families and many other people that live in Prague. Their daily battle against real problems of living in a modern world like divorce, love, betrayal and illness or disease. Ulice often shows crime.",2005-09-05,https://image.tmdb.org/t/p/w500/gFEHva8Csx18hMGJJZ6gi4sFSKR.jpg
256121,Lavender Fields,1285.358,"The life of a simple flower farm girl is shattered when she falls for a charming accountant, who turns out to be a married gun cartel member. Targeted for his stolen money, she loses everything she holds dear and reinvents herself to seek justice.",2024-09-02,https://image.tmdb.org/t/p/w500/7o9eY4qolqVn7SDLZzpJ89t7QYE.jpg
57706,Ranma ½,1265.865,"Ranma Saotome, a teenage martial artist, and his father Genma travel to the 'cursed training ground' of Jusenkyo in China. There, despite the warnings of the Chinese guard, they fall into the cursed springs. From now on, whenever Ranma is doused in cold water, he turns into a girl and a cute, well-built redhead at that. Hot water changes him back into a man again, but only until the next time. To make matters worse, his father engages him to Akane Tendo, a girl who hates boys.",1989-04-15,https://image.tmdb.org/t/p/w500/qb1R5iLZcjIgdDIfXFQXmJadQPI.jpg
46952,The Blacklist,1226.914,"Raymond ""Red"" Reddington, one of the FBI's most wanted fugitives, surrenders in person at FBI Headquarters in Washington, D.C. He claims that he and the FBI have the same interests: bringing down dangerous criminals and terrorists. In the last two decades, he's made a list of criminals and terrorists that matter the most but the FBI cannot find because it does not know they exist. Reddington calls this ""The Blacklist"". Reddington will co-operate, but insists that he will speak only to Elizabeth Keen, a rookie FBI profiler.",2013-09-23,https://image.tmdb.org/t/p/w500/4HTfd1PhgFUenJxVuBDNdLmdr0c.jpg
235484,Suidooster,1219.796,"Suidooster is a South African television soap opera produced by Suidooster Films which revolves around a matriarch, her family, friends and the people of Suidooster, a small shopping and business centre in the fictional Cape Town suburb of Ruiterbosch.",2015-11-16,https://image.tmdb.org/t/p/w500/naCgSiacvV685kait6fBvhVhdce.jpg
549,Law & Order,1204.781,"In cases ripped from the headlines, police investigate serious and often deadly crimes, weighing the evidence and questioning the suspects until someone is taken into custody. The district attorney's office then builds a case to convict the perpetrator by proving the person guilty beyond a reasonable doubt. Working together, these expert teams navigate all sides of the complex criminal justice system to make New York a safer place.",1990-09-13,https://image.tmdb.org/t/p/w500/6vFL8S6Cci8s7SHWXz60xOisGBC.jpg
3034,Scene of the Crime,1191.954,"Tatort is a long-running German/Austrian/Swiss, crime television series set in various parts of these countries. The show is broadcast on the channels of ARD in Germany, ORF in Austria and SF1 in Switzerland.",1970-11-29,https://image.tmdb.org/t/p/w500/b6kIWHHifuc8qH0IpzVzUeXBnvq.jpg
4057,Criminal Minds,1149.49,"An elite team of FBI profilers analyze the country's most twisted criminal minds, anticipating their next moves before they strike again. The Behavioral Analysis Unit's most experienced agent is David Rossi, a founding member of the BAU who returns to help the team solve new cases.",2005-09-22,https://image.tmdb.org/t/p/w500/wLMQebhTApmn4F6Fzg6FovdwVvL.jpg
79744,The Rookie,1146.355,"Starting over isn’t easy, especially for small-town guy John Nolan who, after a life-altering incident, is pursuing his dream of being an LAPD officer. As the force’s oldest rookie, he’s met with skepticism from some higher-ups who see him as just a walking midlife crisis.",2018-10-16,https://image.tmdb.org/t/p/w500/bL1mwXDnH5fCxqc4S2n40hoVyoe.jpg
73586,Yellowstone,1107.229,"Follow the violent world of the Dutton family, who controls the largest contiguous ranch in the United States. Led by their patriarch John Dutton, the family defends their property against constant attack by land developers, an Indian reservation, and America’s first National Park.",2018-06-20,https://image.tmdb.org/t/p/w500/s4QRRYc1V2e68Qy9Wel9MI8fhRP.jpg
235493,De Bondgenoten,1091.39,,2023-10-22,https://image.tmdb.org/t/p/w500/sFgeZT3H1Uz3X1OipPq3WONv0WO.jpg
72879,Tomorrow Is Ours,1082.301,"The story revolves around the people of Sète, France. Their lives are punctuated by family rivalries, romance and scenes from daily life, but also by plots involving police investigations, secrets and betrayals.",2017-07-17,https://image.tmdb.org/t/p/w500/zMWldNZF0wS3L5XkDVFHxYhclcL.jpg
236994,Dragon Ball DAIMA,1060.215,"Mysteriously transformed into mini versions of themselves, Goku and his friends travel to the Demon Realm to uncover the truth and find a cure.",2024-10-11,https://image.tmdb.org/t/p/w500/cIDPZMGsiVHkHA6HPJmEmGcgyyw.jpg
262969,Return to Las Sabinas,1055.391,"Gracia and Paloma return to Las Sabinas to look after their father, Emilio. Gracia reunites with her childhood sweetheart, Miguel, who is now engaged to Esther. Paloma takes over the family's land and clashes with landowner Paca Utrera, who shares a terrible secret with Emilio and has a nefarious plan for the village. Young Óscar is found dead under strange circumstances. Manuela must investigate the murder with the help of Óscar's brother, Álex, who is a priest.",2024-10-11,https://image.tmdb.org/t/p/w500/xMMH3r8gJtWVe1841BtHGjDooUm.jpg
261121,Desperate Mrs. Seonju,1052.185,"Pi Seon Ju works as an interior designer in a small neighborhood. She is married to Jeon Nam Jin, who is an ambitious architect. Although Pi Seon Ju is devoted to her husband, her husband falls in love with Jin Sang A, who will become the successor of an architecture company. To further pursue his love and ambitions, Jeon Nam Jin demands a divorce from Pi Seon Ju. After their divorce, Pi Seon Ju decides to start her new life.

Meanwhile, architect Kim So U is married to Jin Sang A. Unlike Jin Sang A, he is satisfied with a stable situation rather than being fueled with ambition. Due to his wife's affair with Jeon Nam Jin, Kim So U gets divorced. After meeting Pi Seon Ju, Kim So U experiences a turning point in his life.",2024-11-18,https://image.tmdb.org/t/p/w500/wALnisqW9vGGJWH1GYUeCCWTcYd.jpg
262831,My Merry Marriage,1048.009,"A delightful family drama that asks the true meaning of 'happiness' by showing various aspects of marriage such as divorce, remarriage, and single life, and brings about empathy and laughter from all generations.

Maeng Gong Hee is a contract designer at Jayce Fashion. Having inherited her strong mother's spirit and her former detective father's athletic ability, she is a rare wild woman these days who has the guts to survive even if she were to be stranded on a deserted island.

Gu Dan Soo is the grandson of Jayce Fashion Chairman Hwang Ik Seon and born to a wealthy father and a poor mother. Dan Soo, who was living as a free spirit in a foreign country, comes to Korea according to his grandmother's plan to make a successor to the chairman out of him and he reunites with childhood friend Maeng Gong Hee once again.",2024-10-07,https://image.tmdb.org/t/p/w500/lp7uJ6tZ9k8m7kW75hIAOUafXr4.jpg
291,Coronation Street,1018.794,"The residents of Coronation Street are ordinary, working-class people, and the show follows them through regular social and family interactions at home, in the workplace, and in their local pub, the Rovers Return Inn. Britain's longest-running soap.",1960-12-09,https://image.tmdb.org/t/p/w500/5x1HXqYqPyYw7oc7Isu1lvVmwRP.jpg
42912,Inazuma Eleven,1011.893,"Mamoru Endou is a cheerful goalkeeper in Raimon Jr High, with six other players in the team. But there was a day when the team was almost lead to disbandment by Natsumi unless they are able to win the match against the Teikoku Gakuen, currently the best team in Japan. He tried to save the club by gathering four more players to join the team.",2008-10-05,https://image.tmdb.org/t/p/w500/blocZH67QzA1CDbBq6Ik5ftCOXP.jpg
278600,MDR Thüringen Journal,972.129,,1992-01-02,https://image.tmdb.org/t/p/w500/53NTUM6LDxYMbqiQrnLHMqYti3X.jpg
204082,Squid Game: The Challenge,966.05,"In this reality competition show inspired by ""Squid Game,"" 456 players put their skills to the ultimate test for a life-changing $4.56 million prize.",2023-11-22,https://image.tmdb.org/t/p/w500/eAjXAgdjPMZH9Ugub7XYPowFoS1.jpg
91759,Come Home Love: Lo and Behold,956.298,"Hung Sue Gan starting from the bottom, established his own logistics company, which is now running smoothly. His only concern now are his three daughters. His eldest daughter has immigrated overseas. His second daughter Hung Yeuk Shui has reached the marriageable age, but has no hopes for marriage anytime soon. She is constantly bickering with her younger sister Hung Sum Yue, who is an honour student, over trivial matters, causing their father to not know whether to laugh or cry. Hung Sue Yan, Hung Sue Gan's brother, moves in with the family, temporarily ending his life as a nomadic photographer. He joins Hung Yeuk Shui's company and encounters Ko Pak Fei, the director of an online shop. The two appear to be former lovers, making for lots of laughter. Since Hung Sue Yan moved in, a series of strange events have occurred in the family. Upon investigation, the source is traced to Lung Ging Fung, a promising young man who is the son of department store mogul Lung Gam Wai.",2017-02-06,https://image.tmdb.org/t/p/w500/lgD4j9gUGmMckZpWWRJjorWqGVT.jpg
81329,Chronicles of the Sun,936.264,Claire is surprised when she gets arrested for the murder of her childhood friend after she returns to Montpellier.,2018-08-27,https://image.tmdb.org/t/p/w500/t6jVlbPMtZOJoAOfeoR4yQmnjXM.jpg
273911,La mujer de mi vida,932.138,"The series revolves around Ricardo Oribe (Iván Sánchez), a physically unattractive but successful businessman, dedicated to his family and in love with his beautiful wife Daniela (Angélica Celaya), a young aspiring actress. Ricardo's life takes a turn when his best friend Emilio (Mauricio Islas) betrays him and tries to kill him in order to take over his company and the family he never had. Despite being presumed dead by his family and friends, Ricardo is still alive, but suffering from amnesia. After a course of 15 years, Ricardo goes through several physical changes and recovers his memory.",2024-10-08,https://image.tmdb.org/t/p/w500/4Qksv87C57O0IWA8sT2KwxZ4fXh.jpg
273042,Our Honorary Photo Studio,930.727,,2024-11-04,https://image.tmdb.org/t/p/w500/ziHUUJpuuVc9qtN9I95SWpBC3ni.jpg
125988,Silo,928.189,"In a ruined and toxic future, thousands live in a giant silo deep underground. After its sheriff breaks a cardinal rule and residents die mysteriously, engineer Juliette starts to uncover shocking secrets and the truth about the silo.",2023-05-04,https://image.tmdb.org/t/p/w500/tlliQuCupf8fpTH7RAor3aKMGy.jpg
71712,The Good Doctor,924.006,"Shaun Murphy, a young surgeon with autism and savant syndrome, relocates from a quiet country life to join a prestigious hospital's surgical unit. Unable to personally connect with those around him, Shaun uses his extraordinary medical gifts to save lives and challenge the skepticism of his colleagues.",2017-09-25,https://image.tmdb.org/t/p/w500/luhKkdD80qe62fwop6sdrXK9jUT.jpg
32692,Blue Bloods,918.292,"A drama about a multi-generational family of cops dedicated to New York City law enforcement. Frank Reagan is the New York Police Commissioner and heads both the police force and the Reagan brood. He runs his department as diplomatically as he runs his family, even when dealing with the politics that plagued his unapologetically bold father, Henry, during his stint as Chief.",2010-09-24,https://image.tmdb.org/t/p/w500/q1WlrxnCvNhBjJ4N7V0JQXjnIBN.jpg
242931,Pulang Araw,911.539,"Red Sun is a family drama that tells stories of courage, sacrifice, and hardships that every Filipino family has. These stories were inspired by the tales of the unsung heroes who defied the odds of World War II and the Japanese occupation of the Philippines.",2024-07-29,https://image.tmdb.org/t/p/w500/2zbaRzgieKiHYkTGztQUzrAYbgb.jpg
60735,The Flash,901.62,"After being struck by lightning, CSI investigator Barry Allen awakens from a nine-month coma to discover he has been  granted the gift of super speed.  Teaming up with S.T.A.R. Labs, Barry takes on the persona of The Flash, the Fastest  Man Alive, to protect his city.",2014-10-07,https://image.tmdb.org/t/p/w500/yZevl2vHQgmosfwUdVNzviIfaWS.jpg
275464,Escupiré sobre sus tumbas,901.183,"The telenovela follows Brian O'Connor, who wants to avenge the death of his brother Sonny, who was found dead, apparently by suicide, on the Caribbean Coast. Brian will go there in the guise of Vinicio Gallo, a renowned ship captain, to uncover the truth, no matter who he has to go through, even if it is the Obregón Artelli family, one of the most powerful and prestigious families on the Caribbean Coast, whose members are suspects.",2024-10-28,https://image.tmdb.org/t/p/w500/nssLYA0PvK3RVfBh2cV4JXyWXRN.jpg
61818,Late Night with Seth Meyers,884.364,"Seth Meyers, who is ""Saturday Night Live’s"" longest serving anchor on the show’s wildly popular ""Weekend Update,"" takes over as host of NBC’s ""Late Night"" — home to A-list celebrity guests, memorable comedy and the best in musical talent. As the Emmy Award-winning head writer for ""SNL,"" Meyers has established a reputation for sharp wit and perfectly timed comedy, and has gained fame for his spot-on jokes and satire. Meyers takes his departure from ""SNL"" to his new post at ""Late Night,"" as Jimmy Fallon moves to ""The Tonight Show"".",2014-02-25,https://image.tmdb.org/t/p/w500/g6MrJxNaHYGYU7Sxo72e5B8gKOV.jpg
46260,Naruto,877.657,"Naruto Uzumaki, a mischievous adolescent ninja, struggles as he searches for recognition and dreams of becoming the Hokage, the village's leader and strongest ninja.",2002-10-03,https://image.tmdb.org/t/p/w500/xppeysfvDKVx775MFuH8Z9BlpMk.jpg
247885,Papás por Conveniencia,860.975,"Tino, a single father who faces great challenges in raising his two children, finds out one day that he is also the father of two rebellious teenagers, children of Aidé, a former high school classmate who has become an important businesswoman. For Tino, this news becomes an opportunity to take on the role of father of the children he never knew he had. Thus, he begins to work at Aidé's company, but everything gets complicated when Tino and his family move into Aidé's house to integrate into her new life. The house becomes a battlefield, both of their children have problems adapting, and love resurfaces between Tino and Aidé and a torrid romance begins. But building this new life for Aidé, Tino and their children will not be easy; they will have to face serious obstacles, always supported by the strength of their love and that of their children.",2024-10-21,https://image.tmdb.org/t/p/w500/y7yIu9PKx2WTphhYgbBq9C1RNzV.jpg
115472,Exclusiv - Das Star-Magazin,855.483,,1994-03-01,https://image.tmdb.org/t/p/w500/A9MYh8E3YED3koL7mlRcRipRJWc.jpg
76479,The Boys,854.038,A group of vigilantes known informally as “The Boys” set out to take down corrupt superheroes with no more than blue-collar grit and a willingness to fight dirty.,2019-07-25,https://image.tmdb.org/t/p/w500/2zmTngn1tYC1AvfnrFLhxeD82hz.jpg
239526,Sueños de libertad,853.901,,2024-02-25,https://image.tmdb.org/t/p/w500/k0uSCsavcoGviQK9rfyH2srRjhZ.jpg
276465,TMZ Live,849.701,"This hourlong show is an edited version of the previous day's live video chat on TMZ, which features site founder Harvey Levin and others discussing the day's celebrity and entertainment news. Besides news, it provides a candid look at how the gossip site operates, bringing viewers into the site's newsroom, where the daily chats take place. ""TMZ Live"" allows viewers to present their opinions on the featured topics through social media, phone calls and video chat.",2012-06-11,https://image.tmdb.org/t/p/w500/12sC6lRA7ds448jaoDUtj5qGSwh.jpg
52910,Law of the Jungle,848.179,"Law of the Jungle is a hybrid reality show combining elements of drama and documentary. The show is hosted by comedian Kim Byung Man, and each episode invites various celebrities from the various field. So far, many of idol stars and famous actors have appeared on the show. The show introduces viewers to exotic locations around the world where celebrities must work together in order to complete missions and survive. The cast celebrities travel to less habituated, natural places to survive on their own and experience life with local tribes and people. In each location, the guests are tasked to hunt and prepare their meals and also create shelter for the tribe. They sometimes confronted by many difficult challenges. Where will the tribe visit? And how will they survive on their own? Stay tuned to check out!",2011-10-21,https://image.tmdb.org/t/p/w500/b38QkTpxOiQM3Ex9NTc6jg9JAmw.jpg
1408,House,741.728,"Dr. Gregory House, a drug-addicted, unconventional, misanthropic medical genius, leads a team of diagnosticians at the fictional Princeton–Plainsboro Teaching Hospital in New Jersey.",2004-11-16,https://image.tmdb.org/t/p/w500/3Cz7ySOQJmqiuTdrc6CY0r65yDI.jpg
2288,Prison Break,733.392,"Due to a political conspiracy, an innocent man is sent to death row and his only hope is his brother, who makes it his mission to deliberately get himself sent to the same prison in order to break the both of them out, from the inside out.",2005-08-29,https://image.tmdb.org/t/p/w500/5E1BhkCgjLBlqx557Z5yzcN0i88.jpg
4589,Arrested Development,727.881,"The story of a wealthy family that lost everything, and the one son who had no choice but to keep them all together.",2003-11-02,https://image.tmdb.org/t/p/w500/p4r4RD7RsNcJVoz0H6z3dBoTBtW.jpg
1622,Supernatural,726.068,"When they were boys, Sam and Dean Winchester lost their mother to a mysterious and demonic supernatural force. Subsequently, their father raised them to be soldiers. He taught them about the paranormal evil that lives in the dark corners and on the back roads of America ... and he taught them how to kill it. Now, the Winchester brothers crisscross the country in their '67 Chevy Impala, battling every kind of supernatural threat they encounter along the way. ",2005-09-13,https://image.tmdb.org/t/p/w500/KoYWXbnYuS3b0GyQPkbuexlVK9.jpg
