id,name,popularity,overview,first_air_date,poster_path
97860,Tower of God,429.127,"Reach the top, and everything will be yours. At the top of the tower exists everything in this world, and all of it can be yours. You can become a god. This is the story of the beginning and the end of Rachel, the girl who climbed the tower so she could see the stars, and Bam, the boy who needed nothing but her.",2020-04-02,https://image.tmdb.org/t/p/w500/8v8ANBJNUzvA8F6sM20DBt3zZ44.jpg
43017,Great Teacher Onizuka,428.76,"About Eikichi Onizuka, a 22-year-old ex-gangster member and a virgin. He has one ambition that no one ever expected from him. His solely life purpose is to become the greatest high school teacher ever.",1999-06-30,https://image.tmdb.org/t/p/w500/cgcvNzLUQUjkur8zfhHwcadwzVz.jpg
4177,Perry Mason,428.246,The cases of master criminal defense attorney Perry Mason and his staff who handled the most difficult of cases in the aid of the innocent.,1957-09-21,https://image.tmdb.org/t/p/w500/sK6JvgNFP1ClT4aF4nPAZiDpAdk.jpg
119316,Wagle Ki Duniya,428.17,"Three generations of the family live together, who share all their happiness and sorrows. Follow the story of this family as they bring laughter to each other's lives and will make your heart melt. A new generation of the old critically acclaimed show is here to take you on a roller coaster ride of emotions.",2021-02-08,https://image.tmdb.org/t/p/w500/jKonm6Q3vw51Ytd4y7bJ70xJT7l.jpg
60059,Better Call Saul,424.061,"Six years before Saul Goodman meets Walter White. We meet him when the man who will become Saul Goodman is known as Jimmy McGill, a small-time lawyer searching for his destiny, and, more immediately, hustling to make ends meet. Working alongside, and, often, against Jimmy, is “fixer” Mike Ehrmantraut. The series tracks Jimmy’s transformation into Saul Goodman, the man who puts “criminal” in “criminal lawyer"".",2015-02-08,https://image.tmdb.org/t/p/w500/zjg4jpK1Wp2kiRvtt5ND0kznako.jpg
62223,The Late Late Show with James Corden,423.472,"Once Craig Ferguson retires, James Corden will be taking over The Late Late Show. The show is a late night talk show that interviews celebrities and has its own bits. And of course, it's all hosted by James Corden.",2015-03-23,https://image.tmdb.org/t/p/w500/qPmVoG8G9tc1nN8ZwGV2zYcknit.jpg
66515,Brothers,422.656,"Ador is a well known and respected CIDG Police Official, with a loving family as his support. Cardo, on the other hand, loves the solitude of the mountains in the province as a SAF Trooper. Their lives take a sudden turn when Ador gets himself entangled in a syndicate by being betrayed by one of his own colleagues, resulting to his death. To conceal this fact, Cardo was ordered to pretend to be Ador and finish the mission what his brother left behind. He will also be force to pretend to his brother's family and friends, and be re-united with his grandmother, whom he despised, for assuming she abandoned him.",2015-09-28,https://image.tmdb.org/t/p/w500/uX5ldo2snjJuZ8P9AxOharboxJn.jpg
83631,What We Do in the Shadows,422.573,"A documentary-style look into the daily (or rather, nightly) lives of a group of vampires in Staten Island who have “lived” together for hundreds and hundreds of years.",2019-03-27,https://image.tmdb.org/t/p/w500/wa3ZQE9kLnqwN3vQ0NNjg1NPsCa.jpg
45140,Teen Titans Go!,422.439,"Robin, Starfire, Raven, Beast Boy and Cyborg return in all-new, comedic adventures. They may be super heroes who save the world every day ... but somebody still has to do the laundry!",2013-04-23,https://image.tmdb.org/t/p/w500/mTMAxrRaDp0TFpdFVinD3grrqr9.jpg
42573,Slam Dunk,422.041,"Sakuragi Hanamichi is a junior high punk used to getting into fights and being rejected by girls but upon entering high school he meets the girl of his dreams, Haruko Akagi. He will do anything in order to win her heart including joining the school basketball team that is aiming to conquer the nation lead by Haruko's brother. The problem is that Sakuragi has never played basketball before and a freshman sensation is stealing the spotlight and Haruko's affection from him.",1993-10-16,https://image.tmdb.org/t/p/w500/gpkM8VeiYyQuEg9qkAoNplktwe4.jpg
3253,Barney Miller,421.695,"Barney Miller is an American situation comedy television series set in a New York City police station in Greenwich Village. The series originally was broadcast from January 23, 1975 to May 20, 1982 on ABC. It was created by Danny Arnold and Theodore J. Flicker. Noam Pitlik directed the majority of the episodes.",1975-01-23,https://image.tmdb.org/t/p/w500/wfrcuXAlgbPyUenIbCONhICH23h.jpg
43232,Kyo Kara Maoh!,421.425,"Shibuya Yuuri, an ordinary high school boy got flushed in a toilet and he saw himself in another world. He was then declared as the 27th maou or the demon king of the Demon world by Gunter von Christ and Konrad Weller . When Yuuri now travels back to his new home (the castle), he meet up with Konrad's brothers. Wolfram von Biefield became Yuuri's fiancee when Yuuri slapped him for defending his mother's name. As a result, as the aristocrats tradition to propose a marriage, is by slapping one's left or right cheek with the back of your hand. By the time that Wolfram throw the knive and Yuuri picked it up, it means a battle between them. in their fight, Yuuri dodged Wolfram's majutsu and it hitted the girl just beside His Majesty. Yuuri got angry and turned into Maou, and punished Wolfram using his water majutsu. Yuuri fainted and when he came to senses after 3 days of sleeping, he did not remember anything that happened including using his powers.",2004-04-03,https://image.tmdb.org/t/p/w500/2ez4tj98hlSN7QUcneW7NCsOpNo.jpg
67198,Star Trek: Discovery,420.865,"Follow the voyages of Starfleet on their missions to discover new worlds and new life forms, and one Starfleet officer who must learn that to truly understand all things alien, you must first understand yourself.",2017-09-24,https://image.tmdb.org/t/p/w500/xwpOHgym48Ftz7fbJq5te5xoiwu.jpg
65334,Miraculous: Tales of Ladybug & Cat Noir,417.183,"Marinette and Adrien, two Parisian teenagers, are entrusted with powerful jewels in order to transform into superheroes Ladybug and Cat Noir. But neither hero knows the other's true identity — or that they're classmates!",2015-10-19,https://image.tmdb.org/t/p/w500/3bxuTGk0c98gQkgBcKzC6HxQ8B6.jpg
6135,Timewatch,416.719,"Timewatch is a long-running British television series showing documentaries on historical subjects, spanning all human history. It was first broadcast on 29 September 1982 and is produced by the BBC, the Timewatch brandname is used as a banner title in the UK, but many of the individual documentaries can be found on US cable channels without the branding.",1982-09-29,https://image.tmdb.org/t/p/w500/n8x9uDQM1Z0O37s4IHbyMpmG05c.jpg
45937,Streets of Broken Lights,416.325,"Russian detectives unwind the ball of the most intricate and cruel crimes. They are consummate professionals, the best cops in town. Even on the most dangerous missions, this quartet never loses their sense of humor. It is it that helps them find the most incredible ways out of any situation. They uphold the law and emerge victorious.",1998-01-04,https://image.tmdb.org/t/p/w500/szNH2weSSwKndvpD06qGcp06Bb8.jpg
45952,Hunter × Hunter,415.77,"Gon Freecss discovers that the father he had always been told was dead was actually alive the whole time. Ging is a famous Hunter: an individual who has proven themself an elite member of humanity. Gon becomes determined to follow in his father's footsteps, pass the rigorous Hunter Examination.",1999-10-16,https://image.tmdb.org/t/p/w500/eobAuhCJA8oRp814V67WhezVXtQ.jpg
62,The Challenge,415.519,"Each Challenge pits numerous cast members from past seasons of reality shows against each other, dividing them into two separate teams according to different criteria, such as gender, which show they first appeared on, whether or not they're veterans or rookies on the show, etc. The two teams compete in numerous missions in order to win prizes and advance in the overall game.",1998-04-20,https://image.tmdb.org/t/p/w500/gHglz5TlLvHyP4Y680ofcoM8uFc.jpg
953,Maverick,413.725,"The Maverick boys - Bret, Bart, Beau and Brent - are a clan of well-dressed dandies, gamblers who'd much rather make their money playing cards than messing up their fine clothing with actual work. Sly and clever, none of the Mavericks are much for acts of derring do, but they can be courageous when the situation calls for it. Most often, however, they live by their wits and considerable charm.",1957-09-22,https://image.tmdb.org/t/p/w500/psVbZjMHt9f9X7EIks9IQdCMZke.jpg
994,Inspector Rex,412.751,"After his handler is killed, police dog Rex teams up with recently-divorced inspector Richard Moser to investigate crimes and solve mysteries on the streets of Vienna. And they sometimes get help from their two-legged friend, Inspector Stockinger.",1994-11-10,https://image.tmdb.org/t/p/w500/tCzMaMoOdA1cPzV3Ll32ftg3EVO.jpg
1402,The Walking Dead,412.53,Sheriff's deputy Rick Grimes awakens from a coma to find a post-apocalyptic world dominated by flesh-eating zombies. He sets out to find his family and encounters many other survivors along the way.,2010-10-31,https://image.tmdb.org/t/p/w500/yTNP9UOdUbGBUZ7SSVng75IwAaY.jpg
97951,Mayor of Kingstown,412.472,"In a small Michigan town where the business of incarceration is the only thriving industry, the McClusky family are the power brokers between the police, criminals, inmates, prison guards and politicians in a city completely dependent on prisons and the prisoners they contain.",2021-11-14,https://image.tmdb.org/t/p/w500/86OUOPulMiM8rjrQSt4KMev7UAa.jpg
46298,Hunter x Hunter,411.635,"Twelve-year-old Gon Freecss one day discovers that the father he had always been told was dead was alive. His Father, Ging, is a Hunter — a member of society's elite with a license to go anywhere or do almost anything. Gon, determined to follow in his father's footsteps, decides to take the Hunter Examination and eventually find his father to prove himself as a Hunter in his own right. But on the way, he learns that there is more to becoming a Hunter than previously thought, and the challenges that he must face are considered the toughest in the world.",2011-10-02,https://image.tmdb.org/t/p/w500/tolQj5yffSxkEGXusPwNcvYrbph.jpg
60708,Gotham,410.583,"Everyone knows the name Commissioner Gordon. He is one of the crime world's greatest foes, a man whose reputation is synonymous with law and order. But what is known of Gordon's story and his rise from rookie detective to Police Commissioner? What did it take to navigate the multiple layers of corruption that secretly ruled Gotham City, the spawning ground of the world's most iconic villains? And what circumstances created them – the larger-than-life personas who would become Catwoman, The Penguin, The Riddler, Two-Face and The Joker?",2014-09-22,https://image.tmdb.org/t/p/w500/wt3uwxSKbMg5ZNJBUOrsJoDnNWX.jpg
66599,Private Eyes,409.752,Ex-pro hockey player Matt Shade irrevocably changes his life when he teams up with fierce P.I. Angie Everett to form an unlikely investigative powerhouse.,2016-05-26,https://image.tmdb.org/t/p/w500/yPt9IuY2D8g6Lpwh8O8wCDixzt9.jpg
18165,The Vampire Diaries,408.414,"The story of two vampire brothers obsessed with the same girl, who bears a striking resemblance to the beautiful but ruthless vampire they knew and loved in 1864.",2009-09-10,https://image.tmdb.org/t/p/w500/xnow2L5YZTo36T4koZs24zU5oqa.jpg
67075,Mob Psycho 100,408.041,"Shigeo Kageyama, a.k.a. ""Mob,"" is a boy who has trouble expressing himself, but who happens to be a powerful esper. Mob is determined to live a normal life and keeps his ESP suppressed, but when his emotions surge to a level of 100%, something terrible happens to him! As he's surrounded by false espers, evil spirits, and mysterious organizations, what will Mob think? What choices will he make?",2016-07-12,https://image.tmdb.org/t/p/w500/vR7hwaGQ0ySRoq1WobiNRaPs4WO.jpg
42951,Kaiji,407.759,"Kaiji Itou is a good-for-nothing loiterer who spends his days drinking beer and stealing hubcaps—that is, until he ends up being tricked by his former co-worker. Unable to suddenly repay his friend's huge debt all by himself, Kaiji is offered a shady deal to participate in an illegal underground gamble on a cruise ship. This turns out to be nothing more than the beginning of his new life of hell—thrown headlong into a life-threatening roller coaster of mind games, cheating, and deceit.",2007-10-03,https://image.tmdb.org/t/p/w500/hKTG76a11adML9ecbJt07D3jH8i.jpg
46732,MTV Video Music Awards,406.599,An annual award ceremony presented by MTV to honor the best in the music video medium.,1984-09-14,https://image.tmdb.org/t/p/w500/nwcFFwWc0CYKW95ytYQqtC5D3sa.jpg
68398,Dr. Romantic,405.213,"An eccentric, triple board-certified virtuoso surgeon leaves a top job in Seoul and ends up at a provincial hospital, where he mentors young doctors.",2016-11-07,https://image.tmdb.org/t/p/w500/9fbRJgZ2zDTnSUId1bOwsllHNr7.jpg
76773,Station 19,404.083,"A group of heroic firefighters at Seattle Fire Station 19—from captain to newest recruit—risk their lives and hearts both in the line of duty and off the clock. These brave men and women are like family, literally and figuratively, and together they put their own lives in jeopardy as first responders to save the lives of others.",2018-03-22,https://image.tmdb.org/t/p/w500/kxao9HIrGO60EhrCRhSBQ3p3XL0.jpg
74016,The Resident,403.623,"A tough, brilliant senior resident guides an idealistic young doctor through his first day, pulling back the curtain on what really happens, both good and bad, in modern-day medicine.",2018-01-21,https://image.tmdb.org/t/p/w500/2IkYQJlT26yXef2iot7dhRtavSC.jpg
67133,MacGyver,403.419,20-something Angus MacGyver creates a clandestine organization where he uses his knack for solving problems in unconventional ways to help prevent disasters from happening.,2016-09-23,https://image.tmdb.org/t/p/w500/2zAogx9dmSAu2HYxbWzHe4ZaNY5.jpg
157741,Landman,403.399,"Set in the proverbial boomtowns of West-Texas and a modern-day tale of fortune-seeking in the world of oil rigs, the series is an upstairs/downstairs story of roughnecks and wildcat billionaires that are fueling a boom so big it’s reshaping our climate, our economy and our geopolitics.",2024-11-17,https://image.tmdb.org/t/p/w500/AnLq5YSssNWpiD06iYF69wFiaNh.jpg
61441,Yowamushi Pedal,402.282,"Onoda Sakamichi is a rather timid, anime-loving first-year student at Sohoku High School. Upon entering high school, he tried to join the anime research club, but after meeting Imaizumi Shunsuke, a renowned cyclist since middle school, and Naruko Shoukichi, who swept the Kansai cycling championship, he ended up joining the competitive cycling club.",2013-10-07,https://image.tmdb.org/t/p/w500/688PJsb1sVWgosrQCbwT32vJKfI.jpg
1911,Bones,400.887,"Dr. Temperance Brennan and her colleagues at the Jeffersonian's Medico-Legal Lab assist Special Agent Seeley Booth with murder investigations when the remains are so badly decomposed, burned or destroyed that the standard identification methods are useless.",2005-09-13,https://image.tmdb.org/t/p/w500/1bwF1daWnsEYYjbHXiEMdS587fR.jpg
66627,Murders in...,400.527,Murders in... is a collection of French-Belgian police TV movies taking place each time in a different French city and region.,2013-04-23,https://image.tmdb.org/t/p/w500/bbksBu0z69O6qq8PVcPvs5vPL6i.jpg
62688,Supergirl,400.416,"Twenty-four-year-old Kara Zor-El, who was taken in by the Danvers family when she was 13 after being sent away from Krypton, must learn to embrace her powers after previously hiding them. The Danvers teach her to be careful with her powers, until she has to reveal them during an unexpected disaster, setting her on her journey of heroism.",2015-10-26,https://image.tmdb.org/t/p/w500/90mSQajf4STPROA6H7Hh8OvyWdK.jpg
66840,Bull,398.419,"Dr. Jason Bull is the brilliant, brash, and charming founder of a hugely successful trial consulting firm.",2016-09-20,https://image.tmdb.org/t/p/w500/r6bM2rNjSk5b9gWBOOKCVgKbjc0.jpg
61852,Henry Danger,398.157,"When 13-year-old Henry Hart lands a job as Danger, the sidekick-in-training to superhero Captain Man, he must learn to navigate a double life balancing the challenges of 8th grade with the crazy adventures of a real-life crime fighter!",2014-07-26,https://image.tmdb.org/t/p/w500/f3TEP5SROTpL6e520ohhSNbUv1E.jpg
154,Good Times,397.732,"Good Times is an American sitcom that originally aired from February 8, 1974, until August 1, 1979, on the CBS television network. It was created by Eric Monte and Mike Evans, and developed by Norman Lear, the series' primary executive producer. Good Times is a spin-off of Maude, which is itself a spin-off of All in the Family along with The Jeffersons.

The series is set in Chicago. The first two seasons were taped at CBS Television City in Hollywood. In the fall of 1975, the show moved to Metromedia Square, where Norman Lear's own production company was housed.",1974-02-08,https://image.tmdb.org/t/p/w500/zZlaGU4RJMhTKFxmQ6RAEYNjM0l.jpg
2224,The Daily Show,397.251,"The World's Fakest News Team tackle the biggest stories in news, politics and pop culture.",1996-07-22,https://image.tmdb.org/t/p/w500/ixcfyK7it6FjRM36Te4OdblAq4X.jpg
61374,Tokyo Ghoul,396.6,"Ken Kaneki, a bookworm college student, meets Rize, a girl his own age with whom he shares many interests.",2014-07-04,https://image.tmdb.org/t/p/w500/1m4RlC9BTCbyY549TOdVQ5NRPcR.jpg
46639,American Gods,395.574,An ex-con becomes the traveling partner of a conman who turns out to be one of the older gods trying to recruit troops to battle the upstart deities. Based on Neil Gaiman's fantasy novel.,2017-04-30,https://image.tmdb.org/t/p/w500/3KCAZaKHmoMIN9dHutqaMtubQqD.jpg
3137,Babylon 5,394.676,"Babylon 5 is a five-mile long space station located in neutral space. Built by the Earth Alliance in the 2250s, its goal is to maintain peace among the various alien races by providing a sanctuary where grievances and negotiations can be worked out among duly appointed ambassadors. A council made up of representatives from the five major space-faring civilizations - the Earth Alliance, Minbari Federation, Centauri Republic, Narn Regime, and Vorlon Empire - work with the League of Non-Aligned Worlds to keep interstellar relations under control. Aside from its diplomatic function, Babylon 5 also serves as a military post for Earth and a port of call for travelers, traders, businessmen, criminals, and Rangers.",1994-01-26,https://image.tmdb.org/t/p/w500/rj87TqwabgJzslrH4G6BCDseBKV.jpg
69291,Miss Kobayashi's Dragon Maid,394.504,"Kobayashi lives alone in an apartment, until one day, Tohru appeared and they ended up living together. Tooru looks down on humans as inferior and foolish, but having been saved by Kobayashi-san, she does everything she can to repay the debt and help her with various things, although not everything goes according to plan.

A mythical everyday life comedy about a hard working office lady living with a dragon girl.",2017-01-12,https://image.tmdb.org/t/p/w500/tNznuhcf7WKzEmPQEsIgGMrB3Az.jpg
46917,Las Fierbinţi,394.478,"A rural comedy where the intrigues caused by the upcoming elections in a small village give rise to a ridiculous war between the mayor and deputy mayor. Unfortunately, they have no clue that their struggle will prove to be in vain at the end of the election day.",2012-03-01,https://image.tmdb.org/t/p/w500/kAar7sAZDzSh7ElSGNl4vuZmDUw.jpg
61440,Strike the Blood,393.979,"Kojou Akatsuki's days as an ordinary high school student in the Demon District of Itogami Island come to an abrupt end after a fateful encounter leaves him with the remarkable abilities of a vampire.  It isn't long before he is thrust into the center of attention when it is discovered that he is the fourth primogenitor, an immensely powerful vampire whom most consider to be merely a legend. Fearing Kojou's destructive potential, the Lion King Organization sends in an apprentice sword-shaman, Yukina Himeragi, to monitor, and should he become a threat, kill the boy deemed the world's most powerful vampire. Forced together by circumstance, the two form an unlikely alliance as Kojou comes to terms with his abilities and they both struggle to protect the city from various emerging chaotic forces.",2013-10-04,https://image.tmdb.org/t/p/w500/rbGaCkEVS7PE5fKKMAmvO4XZXyA.jpg
65503,Aikatsu!,392.735,"Ichigo Hoshimiya is a regular, ordinary middle school girl. But when her best friend Aoi invites her to join the idol training academy, Starlight Academy, her whole world is turned upside down. As she encounters all kinds of rivals and learns what it takes to be an idol, she uses her Aikatsu Cards to challenge countless auditions.",2012-10-08,https://image.tmdb.org/t/p/w500/xCl0ZBE418ZgEzoy4MrssCLcmff.jpg
95205,The Equalizer,392.729,"Robyn McCall, an enigmatic former CIA operative with a mysterious background, uses her extensive skills to help those with nowhere else to turn.",2021-02-07,https://image.tmdb.org/t/p/w500/oxJG9F16AUji71jpPxkEOBWanMP.jpg
76669,Elite,391.247,"When three working class kids enroll in the most exclusive school in Spain, the clash between the wealthy and the poor students leads to tragedy.",2018-10-05,https://image.tmdb.org/t/p/w500/3NTAbAiao4JLzFQw6YxP1YZppM8.jpg
605,"Sabrina, the Teenage Witch",390.932,"On her sixteenth birthday, Sabrina Spellman discovers she has magical powers. She lives with her 600-year-old aunts Hilda and Zelda as well as talking cat Salem in the fictional town of Westbridge, Massachusetts.",1996-09-27,https://image.tmdb.org/t/p/w500/yGuzsFLr9s4kr9H7NbgrFiaIfUc.jpg
40758,Großstadtrevier,390.746,Follow the everyday work of a fictional police station on the Kiez of Hamburg.,1986-12-16,https://image.tmdb.org/t/p/w500/fVsntDN3mQAuaDFGiJTKar7fRcu.jpg
39340,2 Broke Girls,390.339,"Comedy about the unlikely friendship that develops between two very different young women who meet waitressing at a diner in trendy Williamsburg, Brooklyn, and form a bond over one day owning their own successful cupcake business. Only one thing stands in their way – they’re broke.",2011-09-19,https://image.tmdb.org/t/p/w500/qCa4ANpF1QOioqRUNHgk2B3KFMZ.jpg
484,"Murder, She Wrote",390.099,An unassuming mystery writer turned sleuth uses her professional insight to help solve real-life homicide cases.,1984-09-30,https://image.tmdb.org/t/p/w500/3UxBFG4fiuZ0P9n2sCrjXh64Avy.jpg
62082,Junior League,389.893,"In the town of Podolsk, The Bears hockey club hires a new coach, Sergei Makeyev, a former National Hockey League player, who sets out to get the club to the Junior Hockey League and make The Bears a successful team.",2013-10-07,https://image.tmdb.org/t/p/w500/iUiI4wBTto4qJQZMucM8fc3UeUR.jpg
62715,Dragon Ball Super,389.458,"With Majin Buu defeated half-a-year prior, peace returns to Earth, where Son Goku (now a radish farmer) and his friends now live peaceful lives. However, a new threat appears in the form of Beerus, the God of Destruction. Considered the most terrifying being in the entire universe, Beerus is eager to fight the legendary warrior seen in a prophecy foretold decades ago known as the Super Saiyan God. The series retells the events from the two Dragon Ball Z films, Battle of Gods and Resurrection 'F' before proceeding to an original story about the exploration of alternate universes.",2015-07-05,https://image.tmdb.org/t/p/w500/qEUrbXJ2qt4Rg84Btlx4STOhgte.jpg
61692,Fresh Off the Boat,389.294,"A '90s-set single-camera comedy about a hip-hop-loving Asian kid growing up in suburban Orlando, being raised by an immigrant father obsessed with all things American and an immigrant mother often bewildered by white culture.",2015-02-04,https://image.tmdb.org/t/p/w500/o8ekdtv98EnrymVLw3VJ2WoFBoM.jpg
122801,Skilz,388.181,,2011-09-27,https://image.tmdb.org/t/p/w500/oZ2No0E92770kTOoItLO5zQhaql.jpg
4238,The King of Queens,378.47,"Life’s good for deliveryman Doug Heffernan, until his newly widowed father-in-law, Arthur, moves in with him and his wife Carrie. Doug is no longer the king of his domain, and instead of having a big screen television in his recently renovated basement, he now has a crazy old man.",1998-09-21,https://image.tmdb.org/t/p/w500/vXs300Yvjy4Kr0iHgBtajHkYbAt.jpg
1620,CSI: Miami,332.091,"CSI: Miami follows Crime Scene Investigators working for the Miami-Dade Police Department as they use physical evidence, similar to their Las Vegas counterparts, to solve grisly murders. The series mixes deduction, gritty subject matter, and character-driven drama in the same vein as the original series in the CSI franchise, except that the Miami CSIs are cops first, scientists second.",2002-09-23,https://image.tmdb.org/t/p/w500/mKAyZM3INz3brj1vvltanP5rthF.jpg
4500,The Wonder Years,280.389,"The story of Kevin Arnold facing the trials and tribulations of youth while growing up during the 1960s and 70s. Told through narration from an adult Kevin, Kevin faces the difficulties of maintaining relationships and friendships on his enthralling journey into adulthood.",1988-01-31,https://image.tmdb.org/t/p/w500/tkaduqdhFrF1vp8L55OJfB5jw8Z.jpg
65701,Good Mythical Morning,354.455,"Two ""Internetainers"" (Rhett & Link) go far out and do the weirdest things, giving you a daily dose of casual comedy every Monday-Friday.",2012-01-09,https://image.tmdb.org/t/p/w500/jMpBQr2aNOFAI6wsC47zsOG6qOh.jpg
40905,SOKO Stuttgart,328.865,The SOKO Stuttgart team investigates analytically and with sensitivity in the likeable state capital. The exciting cases of the series lead them to bizarre crime scenes and to different milieus.,2009-11-12,https://image.tmdb.org/t/p/w500/eu50QVZd1b7itOI76oKPUR0Eqvl.jpg
