id,name,popularity,overview,first_air_date,poster_path
68854,From Me to You: Kimi ni Todoke,220.913,"Nicknamed ""Sadako"" for her spooky appearance, high schooler Sawako begins to break out of her shell when she befriends popular boy Kazehaya.",2009-10-07,https://image.tmdb.org/t/p/w500/kka0aBfSmhxYopCW0FzDWzljRhG.jpg
252373,A Promessa,220.781,,2024-06-18,https://image.tmdb.org/t/p/w500/uptgxt2apx5wwWItQzqL0HwhjZC.jpg
97546,Ted Lasso,220.432,"Ted Lasso, an American football coach, moves to England when he’s hired to manage a soccer team—despite having no experience. With cynical players and a doubtful town, will he get them to see the Ted Lasso Way?",2020-08-14,https://image.tmdb.org/t/p/w500/5fhZdwP1DVJ0FyVH6vrFdHwpXIn.jpg
45886,Happy Together,220.228,"The ordinary life of an ordinary family from the province: a couple, 2 children, a dog and neighbors. Dasha is a housewife who loves to watch TV shows and go shopping. Her husband, Gena, is a shoe store manager, likes to hang around in the garage and watch football with friends. Their daughter Sveta is a student of high school, changes the guys every week. And their son Roma is playing computer thew whole day and intrigues sister. Bukins quarrel at least once a day - so they have fun. They have been together for 16 years and still love each other. This is the happiest family in the world.",2006-03-08,https://image.tmdb.org/t/p/w500/1scrmfP33m3fDygD3Q0dgCGoOcP.jpg
39314,Bade Achhe Lagte Hain,220.217,"The show explores the worlds of its protagonists, Priya and Ram Kapoor, who accidentally discover love after getting married.",2011-05-30,https://image.tmdb.org/t/p/w500/6pkYKUNoOkgTfrJbInxgBBlwNrd.jpg
64163,The Testament of Sister New Devil,220.192,"Toujou Basara is a high school student whose father has suddenly just remarried. His father then departs overseas leaving Basara with two new beautiful step-sisters. Little does he know, his new sisters, Mio and Maria are actually the new Demon Lord and a succubus!? Almost trapped into a life of servitude, Basara forms a reverse contract by accident and ends up becoming Mio's master! Hijinks ensue as Basara finds himself in one ecchi situation after another. However, Mio's life is in danger as she is pursued by demons and heroes!",2015-01-07,https://image.tmdb.org/t/p/w500/4yrW5uBgcx7GSehJotlxWjAD0NQ.jpg
92461,Bob Hearts Abishola,219.91,"A love story about a middle-aged compression sock businessman from Detroit who unexpectedly falls for his cardiac nurse, a Nigerian immigrant, while recovering from a heart attack and sets his sights on winning her over.",2019-09-23,https://image.tmdb.org/t/p/w500/7NQRz0RcN2ohT98fZv287YEddtW.jpg
84234,Balthazar,219.44,"Facing a series of complex murder cases, new police commander Hélène Bach must learn to work with the brilliant yet exasperating Raphaël, who can make the dead speak like no-one else.",2018-12-06,https://image.tmdb.org/t/p/w500/98ZGgws85ybGSZ52NWx0iwbmXfL.jpg
66786,Timeless,219.38,"A mysterious criminal steals a secret state-of-the-art time machine, intent on destroying America as we know it by changing the past. Our only hope is an unexpected team: a scientist, a soldier and a history professor, who must use the machine's prototype to travel back in time to critical events. While they must make every effort not to affect the past themselves, they must also stay one step ahead of this dangerous fugitive. But can this handpicked team uncover the mystery behind it all and end his destruction before it's too late?",2016-10-03,https://image.tmdb.org/t/p/w500/wFaS9kROwztTWNxIKBbOLwIgApV.jpg
1435,The Good Wife,219.268,Alicia Florrick boldly assumes full responsibility for her family and re-enters the workforce after her husband's very public sex and political corruption scandal lands him in jail.,2009-09-22,https://image.tmdb.org/t/p/w500/lasNCd45fpPLirlA7QxkuopWro.jpg
64570,Vampire Girl,219.03,"Daisy O'Brian is a normal girl who dreams of a singing career in musical comedy. Her parents are vampires, and per her family tradition, she must decide to become a vampire or not on her 16th birthday. On that day, Daisy decides to stay human to live next to her love, Max, who is her neighbor and classmate.

However, that same day, a fatal accident changes her life forever. The doctor says to her parents that she is not going to make it. So, her parents decide to bite Daisy, to save her, turning her into a vampire. This makes Vicente (her younger brother) the only mortal in the family. From that moment, Daisy leads a double life full of risks, where she must attend a human school, hiding her nature, and also go to vampire school and take classes for newly bitten vampires.",2013-05-14,https://image.tmdb.org/t/p/w500/mWpTjJO99SMusPHdV12UuMwtoNc.jpg
4386,Baywatch,218.998,Join the Baywatch lifeguards on their thrilling adventures filled with beautiful beaches and those iconic red swimsuits.,1989-04-23,https://image.tmdb.org/t/p/w500/34t8WxHn1OcIVpcTxmjYmjX9tE4.jpg
6809,El hormiguero,218.863,"El Hormiguero is a Spanish television program with a live audience focusing on comedy, science, and politics running since September 2006. It is hosted and produced by screenwriter Pablo Motos. The show aired on Spain's Cuatro channel from launch until June 2011 and is now broadcast on Antena 3. Recurring guests on the show include Luis Piedrahita, Raquel Martos, Marron & ""The Man in Black"", and puppet ants Trancas and Barrancas. It has proved a ratings success, and has expanded from a weekly 120-minute show to a daily 40-minute show in its third season, which began on September 17, 2007. The show won the Entertainment prize at the 2009 Rose d'Or ceremony.",2006-09-24,https://image.tmdb.org/t/p/w500/sc7Uy9ynFn3FLbVldF64Izi9RSD.jpg
4354,The Protectors,218.809,"The Protectors is a British television series, an action thriller created by Gerry Anderson. It was Anderson's second TV series using live actors as opposed to electronic marionettes, and also his second to be firmly set in contemporary times. It was also the only Gerry Anderson produced television series that was not of the fantasy or science fiction genres. It was produced by Lew Grade's ITC Entertainment production company. Despite not featuring marionettes or any real science fiction elements, The Protectors became one of Anderson's most popular productions, easily winning a renewal for a second season. A third season was in the planning stages when the show's major sponsor pulled out, forcing its cancellation.

The Protectors first aired in 1972 and 1973, and ran to 52 episodes over two series, each 25 minutes long - making it one of the last series of this type to be produced in a half-hour format. It starred Robert Vaughn as Harry Rule, Nyree Dawn Porter as the Contessa Caroline di Contini, and Tony Anholt as Paul Buchet. Episodes often featured prominent guest actors.",1972-09-29,https://image.tmdb.org/t/p/w500/eLwQbEZNI1Y2Pc2Shg5iruH1H54.jpg
61223,Akame ga Kill!,218.553,"Young Tatsumi travels to the capital of the Empire in order to earn money for his starving people and encounters a world of unimaginable depravity, dominated by the ruthless Prime Minister who controls the child Emperor. Tatsumi is recruited by Night Raid, a group of assassins dedicated to eliminating corruption by mercilessly killing officials and privileged nobles.",2014-07-07,https://image.tmdb.org/t/p/w500/4zPtA0NGIIpLauwuSN1KBBxSVka.jpg
46078,The Voronins,218.414,"The main characters of the series are an ordinary family. The family consists of the following: Kostya (a sports journalist), his wife Vera (a housewife) and their children: Masha and the twins Philip and Kirill. Right on the same landing, where the apartment of the young Voronin family is located, Kostya’s parents live: Galina Ivanovna (housewife, Kostya and Lyonya’s mother, Vera’s mother-in-law), Nikolai Petrovich (Kostya’s and Lyonya’s father, Vera’s father-in-law) and Lyonya (the major of the police) - Kostya's older brother.",2009-11-16,https://image.tmdb.org/t/p/w500/lKW2c9KrIhKy272AYZCzY2SSVcM.jpg
70672,Men on a Mission,218.266,"Male celebs play make-believe as high schoolers, welcoming star transfer students every week and engaging in battles of witty humor and slapstick.",2015-12-05,https://image.tmdb.org/t/p/w500/2jIi55JtYKJTL1km8qHMuUilOWo.jpg
6231,Oshin,218.124,"Oshin is a Japanese serialized morning television drama, which aired on broadcaster NHK from April 4, 1983 to March 31, 1984. The series follows the life of Shin Tanokura during the Meiji period up to the early 1980s. Shin was called ""Oshin"", which is an archaic Japanese cognomen.",1983-04-04,https://image.tmdb.org/t/p/w500/hut6ivvxG1da3ZC6tyJHlh9C7kw.jpg
6127,Agatha Christie's Marple,218.11,"The adventures of Miss Jane Marple, an elderly spinster living in the quiet little village of St Mary Mead. During her many visits to friends and relatives in other villages, Miss Marple often stumbles upon mysterious murders which she helps solve. Although the police are sometimes reluctant to accept Miss Marple's help, her reputation and unparalleled powers of observation eventually win them over.",2004-12-12,https://image.tmdb.org/t/p/w500/nVswrZQpqQND9TgwgbWgz18KgAo.jpg
2595,Knots Landing,217.512,"The domestic adventures, misdeeds and everyday interactions of five families living on a cul-de-sac in a small California community.",1979-12-27,https://image.tmdb.org/t/p/w500/ohcRf8CyVpQiUw2ZTmGQ2I4fH8D.jpg
4060,Medical Center,217.475,Medical Center is a medical drama series which aired on CBS from 1969 to 1976. It was produced by MGM Television.,1969-09-24,https://image.tmdb.org/t/p/w500/gRGYVJYF2g12tx61CLIGeh041G.jpg
71885,grown-ish,217.441,Zoey Johnson heads to college and begins her hilarious journey to adulthood but quickly discovers that not everything goes her way once she leaves the nest.,2018-01-03,https://image.tmdb.org/t/p/w500/nq09OaG43ZESp8uwdkFEBC7iFbk.jpg
91239,Bridgerton,217.393,"Wealth, lust, and betrayal set in the backdrop of Regency era England, seen through the eyes of the powerful Bridgerton family.",2020-12-25,https://image.tmdb.org/t/p/w500/luoKpgVwi1E5nQsi7W0UuKHu2Rq.jpg
99489,The Penthouse,217.147,"A woman puts everything on the line to achieve her goal of being able to move into a luxury penthouse in the Gangnam District. In the process, she gradually finds herself turning into a monster.",2020-10-26,https://image.tmdb.org/t/p/w500/wybv1VgIOMhcHdU3ooikn2LuR1o.jpg
64432,The Magicians,217.105,"Brakebills University is a secret institution specializing in magic. There, amidst an unorthodox education of spellcasting, a group of twenty-something friends soon discover that a magical fantasy world they read about as children is all too real— and poses grave danger to humanity.",2015-12-16,https://image.tmdb.org/t/p/w500/A66dZN98BPEYeFQAhNdNCIXa57d.jpg
41349,Vienna Crime Squad,217.062,SOKO Donau is an Austrian television series.,2005-10-11,https://image.tmdb.org/t/p/w500/6neMXFYe3M2aXznAvVKo5nrTMZf.jpg
4223,Cagney & Lacey,161.575,Mary Beth Lacey and Chris Cagney are teamed up as NYPD police detectives. Their opposing personalities (one is tough and the other sensitive) mesh to make this one of the great crime-fighting duos of all time.,1982-03-25,https://image.tmdb.org/t/p/w500/bAdrchPABFuHK44G3dKXXRIIRiH.jpg
153485,Sazae-san,189.109,The adventures of Sazae Fuguta and her family and friends in their Tokyo suburb.,1969-10-14,https://image.tmdb.org/t/p/w500/sR3tqK13hhpohIfnpd2z3HkpnUb.jpg
61415,Fate/stay night [Unlimited Blade Works],174.812,"A high school student living in Fuyuki City, Japan, is dragged into the Fifth Holy Grail War, a secret magical tournament.",2014-10-12,https://image.tmdb.org/t/p/w500/3bI8db4tIPtgFY8mOqp3AB0YXGi.jpg
4314,Time Squad,194.609,"Time Squad is an American animated television series created by Dave Wasson, following the adventures of a trio of hapless ""time cops"", who travel back in time attempting to correct the course of history. The series ran on Cartoon Network from June 8, 2001, to November 26, 2003, airing 26 episodes in total. Wasson described the series as ""a C-average student's approach to history.""",2001-06-08,https://image.tmdb.org/t/p/w500/tUfNqwX448QhIYIR5nZ9jckKzhH.jpg
4658,ALF,116.934,A furry alien wiseguy comes to live with a terran family after crashing into their garage.,1986-09-22,https://image.tmdb.org/t/p/w500/shRed7ZrCRjdIMEYNx2YBVFkkNu.jpg
207171,Karin,184.921,"A young woman Chiaki whose family runs an old miso company in Nagano Prefecture, the only daughter of old traditional family. For generations, they were making soybean paste for living. Now she needs to take over this business and rebuild it. She lives through the hardships of postwar Japan.",1993-10-04,https://image.tmdb.org/t/p/w500/liP1uausc7tMqxRJq4oV25PSAfg.jpg
79,Dora the Explorer,181.345,A young girl named Dora goes on adventures with her red boot-wearing monkey named Boots.,2000-08-14,https://image.tmdb.org/t/p/w500/wuZAi6JPdlX68s1p7iztmt0p13C.jpg
2730,I Love Lucy,210.006,"Cuban Bandleader Ricky Ricardo would be happy if his wife Lucy would just be a housewife. Instead she tries constantly to perform at the Tropicana where he works, and make life comically frantic in the apartment building they share with landlords Fred and Ethel Mertz, who also happen to be their best friends.",1951-10-15,https://image.tmdb.org/t/p/w500/mPUSrFTvQqwEqTtfukxJBtkbxWj.jpg
37807,Beyblade: Metal Saga,133.973,"A new cast of characters take on the continued battle between good and evil. Gingka, our hero, and his group of loyal friends take on a dangerous group called the Dark Nebula. Dark Nebula’s mission is to take over the world and unleash their evil upon it; but before they can do so, they must destroy Gingka as he is the only person that’s strong enough to stand in their way. The plot thickens as friends become enemies and enemies become allies. Everything starts and ends with Gingka as he struggles to find the strength to defend his world and the honor of Beyblade.",2009-04-05,https://image.tmdb.org/t/p/w500/9Z247cCZOggsLoD4vY4Bg6QsH4U.jpg
78191,You,163.22,"A dangerously charming, intensely obsessive young man goes to extreme measures to insert himself into the lives of those he is transfixed by.",2018-09-09,https://image.tmdb.org/t/p/w500/7bEYwjUvlJW7GerM8GYmqwl4oS3.jpg
61461,Yona of the Dawn,213.469,"The legend of the Four Dragons and the origin of the land has been passed down for generations in the land of Kouka. Currently, Hiryuu Palace has no one else next in line for the throne other than the fifteen year old princess, Yona, who had been raised with care.

Finally, the night of her sixteenth birthday arrives. She expects it to be a wonderful day spent with her peace-loving father, Il, her servant and friend Hak, and her cousin Soo-won, who she had feelings for... However... That night, Yona goes to visit her father to tell him how she really feels, because he opposes to her getting married to Soo-won. However, when she gets to her room, she encounters a shocking truth. The destinies of Yona and the Four Dragons entwine in this period drama fantasy romance!",2014-10-07,https://image.tmdb.org/t/p/w500/aKLARBbIVlluToqSNYNQ0XOLhP.jpg
81356,Sex Education,213.341,Inexperienced Otis channels his sex therapist mom when he teams up with rebellious Maeve to set up an underground sex therapy clinic at school.,2019-01-11,https://image.tmdb.org/t/p/w500/4Bph0hhnDH6dpc0SZIV522bLm4P.jpg
67015,Ice Fantasy,213.277,"The story is set a hundred years after a war between the Empire of Snow (Ice Tribe) and the Fire Tribe, where the Fire Tribe was defeated. However, the war was fatal, leaving Prince Ka Suo and his younger half-brother Ying Kong Shi the only royal heirs and pure-blood ice illusionists left in the Ice Tribe. Conflict ensues after Ka Suo reluctantly ascends to the throne as his lover, Li Luo, and his brother go missing. Ka Suo also accidentally discovers an evil presence lurking in the Ice Tribe's holy shrine. He and his companions enter the mysterious shrine, and defeat head of the shrine, Lady Yuan Ji, only to find out that she has been plotting a conspiracy against him. Ka Suo also experiences hardships in trying to find his lover and brother, not knowing that his brother has lost all of his memories and has become the Fire Prince under his mother's command. A war between the two tribes commences once again, with the two brothers pitted against each other.",2016-07-24,https://image.tmdb.org/t/p/w500/kmXMaUqlyzOQ0zN5e7zPwd8kawa.jpg
241454,Love Next Door,213.165,A woman attempting to reboot her life returns to Korea and becomes entangled with her childhood friend — with whom she shares a complicated history.,2024-08-17,https://image.tmdb.org/t/p/w500/hikbLeofw2epfaEJptSkQ6b22IV.jpg
4860,Waking the Dead,213.102,A detective team apply new techniques to old crimes as they solve cold cases.,2001-06-18,https://image.tmdb.org/t/p/w500/pthoQb9tOrM0gi43ZER4cOKgm8D.jpg
42786,Ah My Buddha!!,212.708,"Sixteen-year-old Ikkou Satonaka has raging hormones that make every other boy's look simply weak in comparison. When he gets turned on, he's literally turned into a super-powerful Buddhist monk capable of vanquishing the most evil of spirits! Ikkou's parents send him to the Saienji Temple to train to become a proper monk under the watchful eye of his grandmother. One of his first challenges is to learn to control his lusty desires - but that's easier said than done when he's surrounded by a bevy of beautiful nun trainees who keep losing their clothes!",2005-07-01,https://image.tmdb.org/t/p/w500/fNT2SVbYfHQ1UyRIrHqbOUuXEWF.jpg
39358,Revenge,212.476,"When Emily Thorne moves to the Hamptons, everyone wonders about the new girl, but she knows everything about them, including what they did to her family. Years ago, they took everything from her. Now, one by one, she's going to make them pay.",2011-09-21,https://image.tmdb.org/t/p/w500/qx7XytRgg1F03NN5BoK8jx3Cyft.jpg
40596,Der Kriminalist,212.427,"Der Kriminalist is a German television series produced by Monaco Film Hamburg, subsidiary of Odeon Film.

Directors during the first season were Sherry Hormann and Torsten C. Fischer, during the second: Thomas Jahn, Jobst Oetzmann and Torsten C. Fischer.",2006-12-08,https://image.tmdb.org/t/p/w500/ymYs7rjjWCkLXPXlxwq5SrhG2Xi.jpg
37606,The Amazing World of Gumball,212.068,"The life of Gumball Watterson, a 12-year old cat who attends middle school in Elmore. Accompanied by his pet, adoptive brother, and best friend Darwin Watterson, he frequently finds himself involved in various shenanigans around the city, during which he interacts with various family members: Anais, Richard, and Nicole Watterson, and other various citizens.",2011-05-03,https://image.tmdb.org/t/p/w500/VYnnyA2hyxi3VUPgCA71mMtt69.jpg
67178,Marvel's The Punisher,211.849,A former Marine out to punish the criminals responsible for his family's murder finds himself ensnared in a military conspiracy.,2017-11-17,https://image.tmdb.org/t/p/w500/tM6xqRKXoloH9UchaJEyyRE9O1w.jpg
68146,Ninja Girl & Samurai Master,211.714,"The anime centers on a young female ninja named Chidori, whose dream is to help the Warring States-era warlord Oda Nobunaga to achieve his goals.",2016-10-04,https://image.tmdb.org/t/p/w500/f7pCCsV0uzQ5O6Ik5X4VQB7iIj.jpg
39881,Alphateam – Die Lebensretter im OP,211.644,"Alphateam – Die Lebensretter im OP was a German hospital drama television series which aired on Sat.1 between 1996 and 2005. The series covered the work of a team of doctors, nurses and caregivers in the fictional Hamburg Hansa Clinic, located in the Altona district.",1997-01-02,https://image.tmdb.org/t/p/w500/4t2pVIAbXruUqTHVGkuWtjegX9u.jpg
198004,King the Land,211.497,"Amid a tense inheritance fight, a charming heir clashes with his hardworking employee who's known for her irresistible smile — which he cannot stand.",2023-06-17,https://image.tmdb.org/t/p/w500/tW8BMRCYSe6nySvZ749pzc31x2m.jpg
42253,K-ON!,211.494,"The Sakuragoaka Girls' Academy curriculum traditionally focuses on the three ""R""s of reading, writing and arithmetic, but Ritsu Tainaka wants to add two more ""R""s: Rock and Roll! To do that, however, Ritsu has to save the Light Music Club from being shut down due to little problems like not having any other members or a faculty advisor. After strong-arming her best friend Mio into joining and convincing Tsumugi Kotobuki to make it a trio, Ritsu's would-be rockers are soon only one talented guitarist short of the quartet they need for school approval. What they get, unfortunately, is Yui Hirasawa, who's never held a guitar in her life, but she's determined to learn! Will the school halls come alive with the sound of music?",2009-04-03,https://image.tmdb.org/t/p/w500/70hf2538UAf7mzzNgvqTlWq6PDf.jpg
4068,Hogan's Heroes,211.29,"Hogan's Heroes is an American television sitcom that ran for 168 episodes from September 17, 1965, to July 4, 1971, on the CBS network. The show was set in a German prisoner of war camp during World War II. Bob Crane starred as Colonel Robert E. Hogan, coordinating an international crew of Allied prisoners running a Special Operations group from the camp. Werner Klemperer played Colonel Wilhelm Klink, the commandant of the camp, and John Banner was the inept sergeant-of-the-guard, Hans Schultz.

The series was popular during its six-season run. In 2013, creators Bernard Fein through his estate and Albert S. Ruddy acquired the sequel and other separate rights to Hogan's Heroes from Mark Cuban through arbitration and a movie based on the show has been planned.",1965-09-17,https://image.tmdb.org/t/p/w500/qifpp3AmNx54Ko4obdwxOWNf0lo.jpg
228091,HK 80's,211.143,"This sitcom  series premiered in 1981 and changed its name every year, from ""Hong Kong 81"" to ""Hong Kong 86."" It was eventually replaced by a new sitcom called ""City Stories."" A total of 1330 episodes were produced, making it the second-longest-running series in Hong Kong, after ""Come Home Love: Lo and Behold"".

Each episode of this series is inspired by current social issues, with early storylines often satirizing society's flaws. The characters, such as ""Chen Ji,"" ""Mrs. Shun,"" ""Uncle Mao,"" ""Jue Wu Yin,"" ""Miss Su,"" ""A Wei,"" and ""Ah Kang,"" mostly hail from the grassroots, leaving a lasting impression on the audience. For example, ""Mrs. Shun,"" portrayed by Lydia Shum, later became a term to describe uneducated women who follow trends blindly. ""Chen Ji,"" played by Lawrence Ng, is a stockbroker who loves to show off his wealth, and his behavior typified that of many Hong Kongers, becoming a byword for the city's nouveau riche.",1981-06-08,https://image.tmdb.org/t/p/w500/6IpuLrhh7XZfIvz0OmFOSJdSORe.jpg
4576,Just Shoot Me!,210.955,"Just Shoot Me! is an American television sitcom that aired for seven seasons on NBC from March 4, 1997, to August 16, 2003, with 148 episodes produced. The show was created by Steven Levitan, the show's executive producer.",1997-03-04,https://image.tmdb.org/t/p/w500/xP2JuabiJvvmVvGsHjDj4IL8gcO.jpg
95396,Severance,210.939,"Mark leads a team of office workers whose memories have been surgically divided between their work and personal lives. When a mysterious colleague appears outside of work, it begins a journey to discover the truth about their jobs.",2022-02-17,https://image.tmdb.org/t/p/w500/Rb7sga832Cyqvafd7CqOzbwdK4.jpg
24106,Captain Tsubasa: Road to 2002,210.72,"Tsubasa becomes a superstar amongst soccer players in Brazil. He is now planning to play in Europe. At an important must-win game, as the fans cheer him on, Tsubasa looks back at the days when he started his soccer life. His passion to make goals and win the game is as strong as it was during his childhood. He recalls the games and moments that had decisive impact on his life. He remembers Goalkeeper Wakabayashi, Genius striker Hyuga, tender-hearted Misaki and Coach Roberto. He was happy to meet them, enjoyed playing with them, and learned many things from them. The whistle sounds and the game begins. Tsubasa dashes for the ball!",2001-10-07,https://image.tmdb.org/t/p/w500/mFQYzHQr6IpzjR3bxFYE2pHBBny.jpg
88795,Grimme-Preis-Verleihung,210.568,,1964-01-16,
424,Torchwood,210.555,"The exploits a team of people whose job is to investigate the unusual, the strange and the extraterrestrial.",2006-10-22,https://image.tmdb.org/t/p/w500/8fxK9SMaKvQMI4a4VAclf2qEtpD.jpg
87940,Hudson & Rex,210.37,"Detective Charlie Hudson teams up with what he calls his ""highly trained law enforcement animal"" German Shepherd dog named Rex who he prefers to team up with because he doesn't talk his ear off.",2019-02-25,https://image.tmdb.org/t/p/w500/nYxEakh4gPFlWBQ0LalUuVxQgES.jpg
46065,Senran Kagura: Ninja Flash,210.367,"The Hanzo Academy is a prestigious prep school with a secret known only to a select few. Behind its walls is a training course for shinobi; trained spies and assassins that centuries ago had served the shoguns for their political and military needs. Today the tradition continues with five young female trainees with diverse personalities: the care-free Asuka, fierce yet perverted Katsuragi, the sweet and innocent Hibari, stoic and protective Yagyuu, and their mature, class representative, Ikaruga.",2013-01-06,https://image.tmdb.org/t/p/w500/v04svAk6eI1ptjmfjYeC4KIJYp9.jpg
2221,The View,210.346,"ABC Daytime's morning chatfest, currently featuring Whoopi Goldberg, Joy Behar, Sunny Hostin, Sara Haines, Alyssa Farah Griffin, and Ana Navarro discussing the most exciting events of the day. Hot topics in the news, the best experts in their field, celebrity interviews and general entertainment are all part of The View.",1997-08-11,https://image.tmdb.org/t/p/w500/zn5ZtKXYo8XOoXUgtQxw7q2CjVt.jpg
